keyword,priority,volume,kd,cpc,intent,seed,flag,published,Ссылка конкурента 1,Ссылка конкурента 2,Ссылка конкурента 3,Заголовок конкурента 1,Заголовок конкурента 2,Заголовок конкурента 3,Сниппет конкурента 1,Сниппет конкурента 2,Сниппет конкурента 3
what is collaborative software,1,390,36,0,I,collaboration software,ok,,,,,,,,,,
what is collaboration software,1,390,38,0,I,collaboration software,ok,,,,,,,,,,
what is a collaboration software,1,390,35,0,I,collaboration software,ok,,,,,,,,,,
how to build an app for my business,1,390,22,5.83,I,business apps,ok,,,,,,,,,,
how to create an app for your business,1,390,20,5.83,I,business apps,ok,,,,,,,,,,
how to create an app for my business,1,390,21,5.83,I,business apps,ok,,,,,,,,,,
how to build an app for your business,1,390,26,5.83,I,business apps,ok,,,,,,,,,,
how to make an app for my business,1,390,22,5.83,I,business apps,ok,,,,,,,,,,
how do i create an app for my business,1,390,27,5.83,I,business apps,ok,,,,,,,,,,
how do you create an app for your business,1,390,22,5.83,I,business apps,ok,,,,,,,,,,
how to make an app for your business,1,390,22,5.83,I,business apps,ok,,,,,,,,,,
how can i make an app for my business,1,390,22,5.83,I,business apps,ok,,,,,,,,,,
how do i make an app for my business,1,390,22,5.83,I,business apps,ok,,,,,,,,,,
how can i create an app for my business,1,390,22,5.83,I,business apps,ok,,,,,,,,,,
common app teacher recommendation,1,320,0,0,I,app recommendations,ok,,,,,,,,,,
teacher recommendations common app,1,320,18,0,I,app recommendations,ok,,,,,,,,,,
why do companies use online collaborative productivity software,1,260,8,0,I,collaboration software,ok,,,,,,,,,,
what is the best game in app store,1,170,27,3.18,I,app store best,ok,,,,,,,,,,
what is the best game on the app store,1,170,24,3.18,I,app store best,ok,,,,,,,,,,
what are the best games on the app store,1,170,24,3.18,I,app store best,ok,,,,,,,,,,
what are the best games in the app store,1,170,24,3.18,I,app store best,ok,,,,,,,,,,
what is the best game in the app store,1,170,24,3.18,I,app store best,ok,,,,,,,,,,
teacher recommendation form common app,1,140,10,0,I,app recommendations,ok,,,,,,,,,,
how many recommendation letters for common app,1,140,9,0,I,app recommendations,ok,,,,,,,,,,
common app teacher recommendation form,1,140,9,0,I,app recommendations,ok,,,,,,,,,,
how to use otter ai with zoom,1,90,21,0,I,otter ai,ok,,,,,,,,,,
how to use ai to take meeting notes,1,90,40,2.02,I,ai note taking,ok,,,,,,,,,,
how to create an app for my business for free,1,90,31,4.37,I,business apps,ok,,,,,,,,,,
how to make app for business,1,90,22,5.05,I,business apps,ok,,,,,,,,,,
how to make an app for business,1,90,22,5.05,I,business apps,ok,,,,,,,,,,
how to create a business app,1,90,22,5.05,I,business apps,ok,,,,,,,,,,
how to add otter ai to zoom,1,70,21,0,I,otter ai,ok,,,,,,,,,,
how to get an app for my business,1,70,19,6.68,I,business apps,ok,,,,,,,,,,
what are cash app business days,1,70,23,0,I,business apps,ok,,,,,,,,,,
how to start an app business,1,70,13,3.75,I,business apps,ok,,,,,,,,,,
how to make cash app a business account,1,70,24,6.75,I,business apps,ok,,,,,,,,,,
how to get an app for your business,1,70,25,6.68,I,business apps,ok,,,,,,,,,,
how do i get an app for my business,1,70,26,6.68,I,business apps,ok,,,,,,,,,,
how to create a cash app business account,1,50,24,6.22,I,business apps,ok,,,,,,,,,,
how to create an app for business,1,50,22,5.76,I,business apps,ok,,,,,,,,,,
how to make an app business,1,50,21,5.76,I,business apps,ok,,,,,,,,,,
how does cash app business account work,1,50,16,5.29,I,business apps,ok,,,,,,,,,,
how does remote access software work,1,40,26,2.11,I,remote work software,ok,,,,,,,,,,
what is cash app business account,1,40,16,0,I,business apps,ok,,,,,,,,,,
how much does google apps for business cost,1,40,31,0.87,I,business apps,ok,,,,,,,,,,
how to connect otter ai to zoom,1,30,12,0,I,otter ai,ok,,,,,,,,,,
what is the best app for storing passwords,1,30,42,1.44,I,app store best,ok,,,,,,,,,,
what is the app for price comparisons,1,30,42,1.58,I,app comparison,ok,,,,,,,,,,
what is the best app for price comparisons,1,30,30,0.43,I,app comparison,ok,,,,,,,,,,
what is the best price comparison app,1,30,32,0.43,I,app comparison,ok,,,,,,,,,,
how to set up cash app business account,1,30,17,0,I,business apps,ok,,,,,,,,,,
how to make a business app,1,30,25,7.91,I,business apps,ok,,,,,,,,,,
how much is google apps for business,1,30,38,1.03,I,business apps,ok,,,,,,,,,,
how to start mobile app business,1,30,22,3.04,I,business apps,ok,,,,,,,,,,
how to start a mobile app business,1,30,19,3.04,I,business apps,ok,,,,,,,,,,
why use google apps for business,1,30,29,0,I,business apps,ok,,,,,,,,,,
how to open a business cash app,1,30,10,5.82,I,business apps,ok,,,,,,,,,,
how to use otter ai to transcribe,1,20,45,1.33,I,otter ai,ok,,,,,,,,,,
what does the common app recommendation look like,1,20,15,0,I,app recommendations,ok,,,,,,,,,,
common app teacher recommendation login,1,20,27,0,"I,N",app recommendations,ok,,,,,,,,,,
teacher recommendation letter common app,1,20,21,0,I,app recommendations,ok,,,,,,,,,,
what are the best free games on the app store,1,20,20,0,I,app store best,ok,,,,,,,,,,
what is the best team collaboration software,1,20,54,0,"I,N",collaboration software,ok,,,,,,,,,,
how to close cash app business account,1,20,7,0,I,business apps,ok,,,,,,,,,,
how to get cash app business account,1,20,24,7.5,I,business apps,ok,,,,,,,,,,
how do you make an app for your business,1,20,33,2.62,I,business apps,ok,,,,,,,,,,
how does business cash app work,1,20,16,0,I,business apps,ok,,,,,,,,,,
how to setup google apps for business,1,20,36,0,I,business apps,ok,,,,,,,,,,
how to use otter ai with microsoft teams,1,10,15,0,I,otter ai,ok,,,,,,,,,,
how to record meeting in zoom app,1,10,24,0,I,meeting recorder app,ok,,,,,,,,,,
how to record zoom meeting on app,1,10,24,0,I,meeting recorder app,ok,,,,,,,,,,
how to record meeting in webex app,1,10,0,0,,meeting recorder app,ok,,,,,,,,,,
how to record meeting on zoom app,1,10,24,0,I,meeting recorder app,ok,,,,,,,,,,
how to record zoom meeting app,1,10,26,0,"I,N",meeting recorder app,ok,,,,,,,,,,
how to record zoom app meeting,1,10,25,0,I,meeting recorder app,ok,,,,,,,,,,
how to write a recommendation on linkedin app,1,10,23,0,I,app recommendations,ok,,,,,,,,,,
how to turn off recommendations on youtube app,1,10,18,0,I,app recommendations,ok,,,,,,,,,,
sample teacher recommendation letter for common app,1,10,0,0,,app recommendations,ok,,,,,,,,,,
what is the best app on the app store,1,10,49,0,I,app store best,ok,,,,,,,,,,
what is the best app store for android,1,10,29,0,I,app store best,ok,,,,,,,,,,
what is the best app store for polaroid tablet,1,10,0,0,,app store best,ok,,,,,,,,,,
what is the best app store,1,10,35,0,I,app store best,ok,,,,,,,,,,
what is the best app on play store,1,10,27,0,I,app store best,ok,,,,,,,,,,
what is the best app in play store,1,10,50,0,I,app store best,ok,,,,,,,,,,
what is the best app for storing loyalty cards,1,10,9,0,I,app store best,ok,,,,,,,,,,
can you claim tools for work on your taxes,1,10,17,0,I,tools for work,ok,,,,,,,,,,
how to insure tools for work,1,10,21,1.86,I,tools for work,ok,,,,,,,,,,
what tools do i need for auto body work,1,10,4,0,I,tools for work,ok,,,,,,,,,,
which is the best tool for software testing,1,10,18,0,I,best software tools,ok,,,,,,,,,,
what is the best collaboration software,1,10,52,0,I,collaboration software,ok,,,,,,,,,,
what is group collaboration software,1,10,37,0,I,collaboration software,ok,,,,,,,,,,
what is team collaboration software,1,10,0,0,,collaboration software,ok,,,,,,,,,,
can you work remotely as a software engineer,1,10,9,0,I,remote work software,ok,,,,,,,,,,
how to create my own app for my business,1,10,0,4.34,,business apps,ok,,,,,,,,,,
how much does an app cost for a business,1,10,28,0,I,business apps,ok,,,,,,,,,,
how to start a mobile app development business,1,10,24,0,I,business apps,ok,,,,,,,,,,
how to sell mobile apps to small businesses,1,10,12,0,I,business apps,ok,,,,,,,,,,
how to start your own business app,1,10,0,10.01,,business apps,ok,,,,,,,,,,
how to add an app to facebook business manager,1,10,0,0,I,business apps,ok,,,,,,,,,,
how to use whatsapp business app,1,10,39,0,I,business apps,ok,,,,,,,,,,
why mobile app for business,1,10,24,0,I,business apps,ok,,,,,,,,,,
how to create business page on linkedin app,1,10,0,0,,business apps,ok,,,,,,,,,,
what does a cash app business account look like,1,10,10,0,I,business apps,ok,,,,,,,,,,
how to add apps to facebook business page,1,10,25,0,I,business apps,ok,,,,,,,,,,
how to send money with cash app business account,1,10,20,0,I,business apps,ok,,,,,,,,,,
how mobile apps can help your business,1,10,18,0,I,business apps,ok,,,,,,,,,,
how to create a free app for my business,1,10,52,4.15,I,business apps,ok,,,,,,,,,,
how to make my own app for my business,1,10,0,2,,business apps,ok,,,,,,,,,,
how to get an iphone app for your business,1,10,14,0,I,business apps,ok,,,,,,,,,,
how to build an app business,1,10,27,0,I,business apps,ok,,,,,,,,,,
how to create your own business app,1,10,26,3.56,I,business apps,ok,,,,,,,,,,
how to start my own app business,1,10,0,0,,business apps,ok,,,,,,,,,,
how to delete google apps for business account,1,10,0,0,,business apps,ok,,,,,,,,,,
how to create your own app for business,1,10,26,0,I,business apps,ok,,,,,,,,,,
how to develop app for business,1,10,20,0,I,business apps,ok,,,,,,,,,,
how to make a business plan for an app,1,10,24,0,I,business apps,ok,,,,,,,,,,
how to remove business account on cash app,1,10,10,0,I,business apps,ok,,,,,,,,,,
why mobile app is important for business,1,10,30,0,I,business apps,ok,,,,,,,,,,
what is cash for business on cash app,1,10,16,0,I,business apps,ok,,,,,,,,,,
how to create my business app,1,10,21,0,I,business apps,ok,,,,,,,,,,
why are mobile apps important for business,1,10,30,0,I,business apps,ok,,,,,,,,,,
how to take cash app off business account,1,10,9,0,I,business apps,ok,,,,,,,,,,
how to design an app for your business,1,10,19,0,I,business apps,ok,,,,,,,,,,
why your business needs an app,1,10,15,0,I,business apps,ok,,,,,,,,,,
how to take my cash app off business,1,10,9,0,I,business apps,ok,,,,,,,,,,
why google my business app is not working,1,10,0,0,,business apps,ok,,,,,,,,,,
how to create facebook business page on app,1,10,22,0,I,business apps,ok,,,,,,,,,,
how to make a business page on facebook app,1,10,14,0,I,business apps,ok,,,,,,,,,,
how to develop an app for your business,1,10,30,0,I,business apps,ok,,,,,,,,,,
why your business needs a mobile app,1,10,21,0,I,business apps,ok,,,,,,,,,,
how to add apps to your facebook business page,1,10,21,0,I,business apps,ok,,,,,,,,,,
why is mobile app important for business,1,10,24,0,I,business apps,ok,,,,,,,,,,
how to create app for my business,1,10,21,4.49,I,business apps,ok,,,,,,,,,,
how do i build an app for my business,1,10,27,4.44,I,business apps,ok,,,,,,,,,,
how to make a business facebook page on app,1,10,14,0,"I,N",business apps,ok,,,,,,,,,,
how to make your own app for your business,1,10,0,0,,business apps,ok,,,,,,,,,,
how to make my own business app,1,10,0,0,,business apps,ok,,,,,,,,,,
why business need mobile apps,1,10,43,0,"I,N",business apps,ok,,,,,,,,,,
why have an app for your business,1,10,16,0,I,business apps,ok,,,,,,,,,,
how to develop an app for business,1,10,19,3.69,I,business apps,ok,,,,,,,,,,
how to create an app for facebook business page,1,10,39,0,I,business apps,ok,,,,,,,,,,
how to create an app for your business free,1,10,28,0,I,business apps,ok,,,,,,,,,,
why mobile apps are important for your business,1,10,32,0,I,business apps,ok,,,,,,,,,,
what is google apps for business,1,10,36,0.84,I,business apps,ok,,,,,,,,,,
how to build app for business,1,10,25,0,I,business apps,ok,,,,,,,,,,
how to create a mobile app for my business,1,10,22,3.55,I,business apps,ok,,,,,,,,,,
what's the difference between personal and business cash app,1,10,16,0,I,business apps,ok,,,,,,,,,,
why google apps for business,1,10,0,0,,business apps,ok,,,,,,,,,,
how to close google apps for business account,1,10,15,0,I,business apps,ok,,,,,,,,,,
how to build an app for your small business,1,10,26,0,I,business apps,ok,,,,,,,,,,
how to get an app created for your business,1,10,21,0,I,business apps,ok,,,,,,,,,,
what are google apps for business,1,10,34,0.84,I,business apps,ok,,,,,,,,,,
how much is google apps for small business,1,10,25,0,I,business apps,ok,,,,,,,,,,
how to share contacts in google apps for business,1,10,17,0,I,business apps,ok,,,,,,,,,,
what are the best productivity and tracking apps,1,0,0,0,,best productivity apps,ok,,,,,,,,,,
how to recommend a friend on facebook app,1,0,0,0,,app recommendations,ok,,,,,,,,,,
how to recommend someone on linkedin app,1,0,0,0,,app recommendations,ok,,,,,,,,,,
how to recommend a page on facebook app,1,0,0,0,,app recommendations,ok,,,,,,,,,,
how to make recommendations in app,1,0,10,0,I,app recommendations,ok,,,,,,,,,,
how to turn off recommended for you on youtube app,1,0,0,0,,app recommendations,ok,,,,,,,,,,
common app teacher recommendation form 2013,1,0,0,0,,app recommendations,ok,,,,,,,,,,
how to delete recommended videos from youtube app,1,0,0,0,,app recommendations,ok,,,,,,,,,,
college app teacher recommendation,1,0,0,0,,app recommendations,ok,,,,,,,,,,
how to stop recommendations on youtube app,1,0,0,0,,app recommendations,ok,,,,,,,,,,
what is the best facebook store app,1,0,0,0,,app store best,ok,,,,,,,,,,
what is the best app store for tablets,1,0,0,0,,app store best,ok,,,,,,,,,,
what tools do i need for stained glass work,1,0,0,0,,tools for work,ok,,,,,,,,,,
which fleet management software offers the best reporting tools,1,0,0,0,,best software tools,ok,,,,,,,,,,
how compliance teams evaluate software for audit and exam readiness,1,0,0,0,,software for teams,ok,,,,,,,,,,
how compliance teams evaluate software for exam and audit readiness,1,0,0,0,,software for teams,ok,,,,,,,,,,
how to create software for internal teams,1,0,0,0,,software for teams,ok,,,,,,,,,,
how to choose erp software for financial teams,1,0,0,0,,software for teams,ok,,,,,,,,,,
what is collaborative software from microsoft,1,0,0,0,,collaboration software,ok,,,,,,,,,,
what is social media collaboration software,1,0,0,0,,collaboration software,ok,,,,,,,,,,
what does collaboration software consist of,1,0,0,0,,collaboration software,ok,,,,,,,,,,
how to find the best social media collaboration software,1,0,0,0,,collaboration software,ok,,,,,,,,,,
best lms software to use when working remotely,1,0,0,0,,remote work software,ok,,,,,,,,,,
