keyword,priority,volume,kd,cpc,intent,seed,flag,published,Ссылка конкурента 1,Ссылка конкурента 2,Ссылка конкурента 3,Заголовок конкурента 1,Заголовок конкурента 2,Заголовок конкурента 3,Сниппет конкурента 1,Сниппет конкурента 2,Сниппет конкурента 3
record a zoom meeting,P1,920,28,2.89,I,zoom meeting recorder,ok,,,,,,,,,,
zoom meeting transcription,P1,590,13,2.16,I,zoom transcription,ok,,,,,,,,,,
download zoom recording,P1,590,13,0,I,zoom meeting recorder,ok,,,,,,,,,,
how to download a zoom recording,P1,590,13,0,I,zoom meeting recorder,ok,,,,,,,,,,
downloading zoom recordings,P1,590,13,0,I,zoom meeting recorder,ok,,,,,,,,,,
can i record a zoom meeting,P1,590,18,0.19,I,zoom meeting recorder,ok,,,,,,,,,,
video recorder with zoom,P1,590,19,0.51,I,zoom meeting recorder,ok,,,,,,,,,,
how to share zoom recording,P1,590,20,0,I,zoom meeting recorder,ok,,,,,,,,,,
how do i share a zoom recording,P1,590,20,0,I,zoom meeting recorder,ok,,,,,,,,,,
zoom record,P1,760,38,1,I,zoom meeting recorder,ok,,,,,,,,,,
zoom video recorder,P1,590,22,0.51,I,zoom meeting recorder,ok,,,,,,,,,,
how to share zoom recordings,P1,590,22,0,I,zoom meeting recorder,ok,,,,,,,,,,
how to record zoom,P1,660,31,0.37,I,zoom meeting recorder,ok,,,,,,,,,,
how to share a zoom recording,P1,590,24,0,I,zoom meeting recorder,ok,,,,,,,,,,
record zoom meeting,P1,540,19,2.89,I,zoom meeting recorder,ok,,,,,,,,,,
zoom video recordings,P1,590,28,0.51,I,zoom meeting recorder,ok,,,,,,,,,,
zoom video recording,P1,590,29,0.51,"I,N",zoom meeting recorder,ok,,,,,,,,,,
zoom the cloud meeting,P1,590,30,0.32,I,zoom meeting recorder,ok,,,,,,,,,,
otter ai zoom transcription,P1,590,34,2.09,I,zoom meeting notes,ok,,,,,,,,,,
zoom ai companion,P2,5700,64,1.85,I,zoom meeting notes,ok,,,,,,,,,,
where do my zoom recordings go,P2,480,12,0,I,zoom meeting recorder,ok,,,,,,,,,,
where does my zoom recording go,P2,480,12,0,I,zoom meeting recorder,ok,,,,,,,,,,
how to save zoom recordings,P2,480,16,0,I,zoom meeting recorder,ok,,,,,,,,,,
how to save zoom recording,P2,480,16,0,I,zoom meeting recorder,ok,,,,,,,,,,
how to record meeting on zoom,P2,480,20,0.09,I,zoom meeting recorder,ok,,,,,,,,,,
zoom notes,P2,480,23,2.3,I,zoom meeting notes,ok,,,,,,,,,,
notes zoom,P2,480,23,2.3,I,zoom meeting notes,ok,,,,,,,,,,
zoom ai transcription,P2,480,26,2.39,I,zoom meeting notes,ok,,,,,,,,,,
note zoom,P2,480,28,2.3,I,zoom meeting notes,ok,,,,,,,,,,
where is my zoom recording,P2,390,12,0,I,zoom meeting recorder,ok,,,,,,,,,,
transcribe zoom,P2,410,18,2.23,I,zoom transcription,ok,,,,,,,,,,
how to record zoom call,P2,390,14,1.06,I,zoom meeting recorder,ok,,,,,,,,,,
how to record a meeting,P2,390,17,1.86,I,zoom meeting recorder,ok,,,,,,,,,,
how to find recorded zoom meetings,P2,320,0,0,I,zoom meeting recorder,ok,,,,,,,,,,
how to record zoom meeting on phone,P2,390,18,1.09,I,zoom meeting recorder,ok,,,,,,,,,,
where do i find my zoom recordings,P2,390,19,0.03,I,zoom meeting recorder,ok,,,,,,,,,,
how to record zoom meeting on iphone,P2,390,19,1.14,I,zoom meeting recorder,ok,,,,,,,,,,
zoom audio video,P2,480,35,0.85,I,zoom meeting recorder,ok,,,,,,,,,,
zoom download video,P2,390,20,0,I,zoom meeting recorder,ok,,,,,,,,,,
can you record with zoom,P2,390,20,0.04,I,zoom meeting recorder,ok,,,,,,,,,,
how to save a zoom recording,P2,390,23,0,I,zoom meeting recorder,ok,,,,,,,,,,
how do you record on zoom,P2,390,23,0.02,I,zoom meeting recorder,ok,,,,,,,,,,
zoom cloud conferencing,P2,480,39,0.46,I,zoom meeting recorder,ok,,,,,,,,,,
record zoom,P2,390,25,1.69,I,zoom meeting recorder,ok,,,,,,,,,,
zoom live transcript,P2,320,9,2.26,I,zoom transcription,ok,,,,,,,,,,
how to record meeting,P2,390,26,1.86,I,zoom meeting recorder,ok,,,,,,,,,,
can you record on zoom,P2,390,26,0.04,I,zoom meeting recorder,ok,,,,,,,,,,
zoom live transcriptions,P2,320,10,2.26,I,zoom transcription,ok,,,,,,,,,,
zoom live transcription,P2,320,10,2.26,I,zoom transcription,ok,,,,,,,,,,
where can i find my zoom recordings,P2,320,12,0.03,I,zoom meeting recorder,ok,,,,,,,,,,
find zoom recording,P2,320,12,0,I,zoom meeting recorder,ok,,,,,,,,,,
recordings zoom,P2,390,28,1.69,I,zoom meeting recorder,ok,,,,,,,,,,
zoom meeting recorder app,P2,320,13,1.44,I,zoom meeting recorder,ok,,,,,,,,,,
record zoom meeting as participant,P2,320,14,1.55,I,zoom meeting recorder,ok,,,,,,,,,,
zoom live transcripts,P2,320,16,2.26,I,zoom transcription,ok,,,,,,,,,,
can you record zoom calls,P2,320,16,0.03,I,zoom meeting recorder,ok,,,,,,,,,,
how to view zoom recording,P2,320,16,0,I,zoom meeting recorder,ok,,,,,,,,,,
how to get transcript from zoom recording,P2,320,18,1.44,I,zoom transcription,ok,,,,,,,,,,
how to record a zoom meeting on iphone,P2,320,18,0.89,I,zoom meeting recorder,ok,,,,,,,,,,
can you record a zoom call,P2,320,19,0.03,I,zoom meeting recorder,ok,,,,,,,,,,
record a zoom call,P2,320,19,2.41,I,zoom meeting recorder,ok,,,,,,,,,,
find zoom recordings,P2,320,19,0,I,zoom meeting recorder,ok,,,,,,,,,,
finding zoom recordings,P2,320,19,0,I,zoom meeting recorder,ok,,,,,,,,,,
how to get zoom recordings,P2,320,19,0.06,I,zoom meeting recorder,ok,,,,,,,,,,
how do i record on zoom,P2,320,20,0.07,I,zoom meeting recorder,ok,,,,,,,,,,
cloud recording,P2,320,21,4.75,I,zoom meeting recorder,ok,,,,,,,,,,
how to get zoom recording,P2,320,22,0.06,I,zoom meeting recorder,ok,,,,,,,,,,
zoom recorder video,P2,320,25,1.47,I,zoom meeting recorder,ok,,,,,,,,,,
record zoom calls,P2,320,25,2.41,I,zoom meeting recorder,ok,,,,,,,,,,
zoom meeting recording app,P2,320,26,1.44,I,zoom meeting recorder,ok,,,,,,,,,,
screen capure video,P2,590,60,1.09,I,zoom meeting recorder,ok,,,,,,,,,,
how to record meetings,P2,390,40,1.86,I,zoom meeting recorder,ok,,,,,,,,,,
record zoom call,P2,320,28,2.41,I,zoom meeting recorder,ok,,,,,,,,,,
zoom rec,P2,390,41,2.72,I,zoom meeting recorder,ok,,,,,,,,,,
where to find recorded zoom meetings,P2,260,12,0,I,zoom meeting recorder,ok,,,,,,,,,,
how to see zoom recordings,P2,260,12,0,I,zoom meeting recorder,ok,,,,,,,,,,
how to record a zoom meeting as a participant,P2,260,13,1.03,I,zoom meeting recorder,ok,,,,,,,,,,
zoom recording download,P2,260,13,0,I,zoom meeting recorder,ok,,,,,,,,,,
where do zoom recordings go on mac,P2,260,13,0,I,zoom meeting recorder,ok,,,,,,,,,,
where is the record button on zoom,P2,260,13,0,I,zoom meeting recorder,ok,,,,,,,,,,
zoom meeting recording software,P2,320,30,0,I,zoom meeting recorder,ok,,,,,,,,,,
how to turn on transcript in zoom,P2,260,18,0,I,zoom transcription,ok,,,,,,,,,,
how to find my zoom recording,P2,260,18,0.05,I,zoom meeting recorder,ok,,,,,,,,,,
where are my zoom recordings,P2,260,19,0.05,I,zoom meeting recorder,ok,,,,,,,,,,
how do i find my zoom recording,P2,260,19,0.02,I,zoom meeting recorder,ok,,,,,,,,,,
zoom recording video,P2,320,36,1.47,"I,N",zoom meeting recorder,ok,,,,,,,,,,
how to see zoom recording,P2,260,22,0,I,zoom meeting recorder,ok,,,,,,,,,,
does zoom record meetings,P2,260,24,0,I,zoom meeting recorder,ok,,,,,,,,,,
zoom webinar recordings,P2,260,26,0,I,zoom meeting recorder,ok,,,,,,,,,,
where do recorded zoom meetings go,P2,210,12,0,I,zoom meeting recorder,ok,,,,,,,,,,
where are zoom recordings saved,P2,210,12,0,I,zoom meeting recorder,ok,,,,,,,,,,
where is zoom recording saved,P2,210,12,0,I,zoom meeting recorder,ok,,,,,,,,,,
how to find a zoom recording,P2,210,12,0,I,zoom meeting recorder,ok,,,,,,,,,,
transcribe zoom recording,P2,210,13,2.61,I,zoom transcription,ok,,,,,,,,,,
how to get zoom transcript,P2,210,13,1.59,I,zoom transcription,ok,,,,,,,,,,
how to record zoom meeting on mac,P2,210,13,0.83,I,zoom meeting recorder,ok,,,,,,,,,,
zoom webinar recording,P2,260,30,0,I,zoom meeting recorder,ok,,,,,,,,,,
can you screen record a zoom meeting,P2,210,14,0.36,I,zoom meeting recorder,ok,,,,,,,,,,
zoom meeting notes,P2,260,33,2.93,I,ai note taker for zoom,ok,,,,,,,,,,
zoom recordings transcript,P2,210,18,2.06,I,zoom transcription,ok,,,,,,,,,,
zoom recording transcript,P2,210,18,2.06,I,zoom transcription,ok,,,,,,,,,,
transcribe zoom recordings,P2,210,18,2.61,I,zoom transcription,ok,,,,,,,,,,
zoom notetaker,P2,260,34,3.2,I,zoom meeting notes,ok,,,,,,,,,,
access zoom recordings,P2,210,19,0,I,zoom meeting recorder,ok,,,,,,,,,,
where can i find zoom recordings,P2,210,19,0,I,zoom meeting recorder,ok,,,,,,,,,,
how to record zoom meeting on laptop,P2,210,19,0.69,I,zoom meeting recorder,ok,,,,,,,,,,
recordings on zoom,P2,220,24,1,I,zoom meeting recorder,ok,,,,,,,,,,
zoom recording software,P2,210,22,3.49,I,zoom meeting recorder,ok,,,,,,,,,,
can zoom meetings be recorded,P2,210,27,0.03,I,zoom meeting recorder,ok,,,,,,,,,,
zoom calls recorded,P2,210,32,3.45,I,zoom meeting recorder,ok,,,,,,,,,,
zoom call recording,P2,210,36,3.45,I,zoom meeting recorder,ok,,,,,,,,,,
ai meeting summary,P2,210,37,3.37,I,zoom meeting notes,ok,,,,,,,,,,
ai meeting summaries,P2,210,46,3.37,I,zoom meeting notes,ok,,,,,,,,,,
ai for note taking,P2,210,46,2.82,I,zoom notetaker,ok,,,,,,,,,,
ai tools for note taking,P2,210,48,2.78,I,ai note taker for zoom,ok,,,,,,,,,,
ai that listens and takes notes,P2,210,54,4.21,I,ai note taker for zoom,ok,,,,,,,,,,
how to record a zoom meeting,P3,8100,72,0.99,I,zoom meeting recorder,ok,,,,,,,,,,
how to record zoom meeting,P3,8100,72,0.99,I,zoom meeting recorder,ok,,,,,,,,,,
recording zoom,P3,6600,71,1,I,zoom meeting recorder,ok,,,,,,,,,,
how to record on zoom,P3,5400,70,0.08,I,zoom meeting recorder,ok,,,,,,,,,,
zoom recording,P3,5400,73,0.29,I,zoom meeting recorder,ok,,,,,,,,,,
zoom recordings,P3,2400,71,0.29,I,zoom meeting recorder,ok,,,,,,,,,,
recording in zoom,P3,2400,72,1,I,zoom meeting recorder,ok,,,,,,,,,,
zoom ai,P3,1800,69,2.03,I,zoom meeting notes,ok,,,,,,,,,,
record in zoom,P3,1500,72,1,I,zoom meeting recorder,ok,,,,,,,,,,
zoom meeting recording,P3,1300,72,2.29,I,zoom meeting recorder,ok,,,,,,,,,,
zoom cloud recording,P3,1000,72,0.74,I,zoom meeting recorder,ok,,,,,,,,,,
zoom cloud meeting,P3,480,68,0.46,I,zoom meeting recorder,ok,,,,,,,,,,
transcribe zoom recording to text free,P3,170,13,2.03,I,zoom transcription,ok,,,,,,,,,,
how to download zoom transcript,P3,170,13,0,I,zoom transcription,ok,,,,,,,,,,
how to get zoom transcript after meeting,P3,170,13,2.07,I,zoom transcription,ok,,,,,,,,,,
can i screen record a zoom meeting,P3,170,14,0.54,"I,N",zoom meeting recorder,ok,,,,,,,,,,
how to record a zoom meeting on laptop,P3,170,16,0.09,I,zoom meeting recorder,ok,,,,,,,,,,
how to access recorded zoom meetings,P3,170,16,0,I,zoom meeting recorder,ok,,,,,,,,,,
zoom transcription feature,P3,170,18,2.39,I,zoom transcription,ok,,,,,,,,,,
how to get a transcript of a zoom meeting,P3,170,18,1.6,I,zoom transcription,ok,,,,,,,,,,
how to enable transcript in zoom,P3,170,18,0,I,zoom transcription,ok,,,,,,,,,,
how to enable transcription in zoom,P3,170,19,0,I,zoom transcription,ok,,,,,,,,,,
how can i record a zoom meeting,P3,170,19,1.79,I,zoom meeting recorder,ok,,,,,,,,,,
can you record a zoom meeting on your phone,P3,170,20,1.33,I,zoom meeting recorder,ok,,,,,,,,,,
how to record on zoom meeting,P3,170,20,0.9,I,zoom meeting recorder,ok,,,,,,,,,,
otter ai zoom,P3,170,21,0.89,I,zoom meeting notes,ok,,,,,,,,,,
otterai zoom,P3,170,21,0.89,I,zoom meeting notes,ok,,,,,,,,,,
are zoom meetings recorded,P3,170,21,0,I,zoom meeting recorder,ok,,,,,,,,,,
how do you record a zoom meeting,P3,150,18,0.99,I,zoom meeting recorder,ok,,,,,,,,,,
zoom transcription services,P3,140,13,4.81,I,zoom transcription,ok,,,,,,,,,,
how to transcribe a zoom recording,P3,140,13,2.32,I,zoom transcription,ok,,,,,,,,,,
how do i record a zoom meeting,P3,150,19,0.99,I,zoom meeting recorder,ok,,,,,,,,,,
record zoom meeting on computer,P3,140,14,1.63,I,zoom meeting recorder,ok,,,,,,,,,,
how to screen record a zoom meeting,P3,140,16,1.05,"I,N",zoom meeting recorder,ok,,,,,,,,,,
zoom summary,P3,170,32,1.98,I,zoom meeting notes,ok,,,,,,,,,,
zoom audio transcript,P3,140,18,1.88,I,zoom transcription,ok,,,,,,,,,,
how to transcribe on zoom,P3,140,18,1.49,I,zoom transcription,ok,,,,,,,,,,
record zoom meeting on phone,P3,140,18,1.84,I,zoom meeting recorder,ok,,,,,,,,,,
recording zoom meetings on phone,P3,140,18,1.84,I,zoom meeting recorder,ok,,,,,,,,,,
zoom transcribe,P3,140,19,2.04,I,zoom transcription,ok,,,,,,,,,,
zoom automatic transcription,P3,140,19,2.01,I,zoom transcription,ok,,,,,,,,,,
zoom audio transcription,P3,140,19,1.88,I,zoom transcription,ok,,,,,,,,,,
zoom auto transcript,P3,140,19,2.01,I,zoom transcription,ok,,,,,,,,,,
zoom auto transcription,P3,140,19,2.01,I,zoom transcription,ok,,,,,,,,,,
how to record a meeting on zoom,P3,150,25,0.99,I,zoom meeting recorder,ok,,,,,,,,,,
how to record a meeting in zoom,P3,150,25,0.99,I,zoom meeting recorder,ok,,,,,,,,,,
zoom transcription service,P3,140,20,4.81,I,zoom transcription,ok,,,,,,,,,,
can i record a zoom meeting on my phone,P3,140,20,2.11,I,zoom meeting recorder,ok,,,,,,,,,,
how to share a recorded zoom meeting,P3,140,24,0,I,zoom meeting recorder,ok,,,,,,,,,,
zoom how to record meeting,P3,140,25,0,I,zoom meeting recorder,ok,,,,,,,,,,
zoom meeting recording location,P3,110,12,0,I,zoom meeting recorder,ok,,,,,,,,,,
how to get transcripts from zoom,P3,110,13,1.19,I,zoom transcription,ok,,,,,,,,,,
how to download transcript from zoom,P3,110,13,0,I,zoom transcription,ok,,,,,,,,,,
how to get transcript of zoom recording,P3,110,14,1.41,I,zoom transcription,ok,,,,,,,,,,
how to get a transcript from a zoom recording,P3,110,14,1.95,I,zoom transcription,ok,,,,,,,,,,
meeting summary ai,P3,140,34,3.59,I,zoom ai notes,ok,,,,,,,,,,
how to view recorded zoom meetings,P3,110,16,0,I,zoom meeting recorder,ok,,,,,,,,,,
transcription on zoom,P3,110,18,1.52,I,zoom transcription,ok,,,,,,,,,,
transcribing on zoom,P3,110,18,1.52,I,zoom transcription,ok,,,,,,,,,,
transcript on zoom,P3,110,18,1.52,I,zoom transcription,ok,,,,,,,,,,
transcription zoom,P3,110,19,1.68,I,zoom transcription,ok,,,,,,,,,,
transcript zoom,P3,110,19,1.68,I,zoom transcription,ok,,,,,,,,,,
zoom transcription settings,P3,110,19,0,I,zoom transcription,ok,,,,,,,,,,
how to record in zoom meeting,P3,110,19,0,I,zoom meeting recorder,ok,,,,,,,,,,
can i record zoom meeting,P3,110,19,1.09,I,zoom meeting recorder,ok,,,,,,,,,,
how do i record my zoom meeting,P3,110,20,1.06,I,zoom meeting recorder,ok,,,,,,,,,,
can you record zoom meetings for free,P3,110,20,0.75,"I,N",zoom meeting recorder,ok,,,,,,,,,,
zoom note taking ai,P3,110,23,2.74,I,zoom meeting notes,ok,,,,,,,,,,
how to record zoom meeting as host,P3,110,25,0.67,I,zoom meeting recorder,ok,,,,,,,,,,
where do zoom meeting recordings go,P3,90,12,0,I,zoom meeting recorder,ok,,,,,,,,,,
download zoom transcript,P3,90,13,0,I,zoom transcription,ok,,,,,,,,,,
how to get a zoom transcript,P3,90,13,1.55,I,zoom transcription,ok,,,,,,,,,,
how to record a zoom meeting on mac,P3,90,13,0.91,I,zoom meeting recorder,ok,,,,,,,,,,
zoom transcript download,P3,90,14,1.93,I,zoom transcription,ok,,,,,,,,,,
how to record zoom meeting as a participant,P3,90,14,1.19,I,zoom meeting recorder,ok,,,,,,,,,,
zoom call transcription,P3,90,16,2.16,I,zoom transcription,ok,,,,,,,,,,
screen recorder zoom meeting,P3,90,16,1.64,"I,N",zoom meeting recorder,ok,,,,,,,,,,
how to watch a recorded zoom meeting,P3,90,16,0,I,zoom meeting recorder,ok,,,,,,,,,,
how to see recorded zoom meetings,P3,90,16,0,I,zoom meeting recorder,ok,,,,,,,,,,
transcript in zoom,P3,90,18,1.88,I,zoom transcription,ok,,,,,,,,,,
transcription in zoom,P3,90,19,1.88,I,zoom transcription,ok,,,,,,,,,,
how to turn on zoom transcription,P3,90,19,0,I,zoom transcription,ok,,,,,,,,,,
how to find a recorded zoom meeting,P3,90,19,0,I,zoom meeting recorder,ok,,,,,,,,,,
how do i record zoom meeting,P3,90,19,1.88,I,zoom meeting recorder,ok,,,,,,,,,,
zoom meeting note taker,P3,110,34,2.37,I,zoom meeting notes,ok,,,,,,,,,,
screen record zoom meeting,P3,90,20,1.64,"I,N",zoom meeting recorder,ok,,,,,,,,,,
how to record your zoom meeting,P3,90,20,4,I,zoom meeting recorder,ok,,,,,,,,,,
can a zoom meeting be recorded,P3,90,21,0.02,I,zoom meeting recorder,ok,,,,,,,,,,
how to record and save a zoom meeting,P3,90,22,0,I,zoom meeting recorder,ok,,,,,,,,,,
how to record my zoom meeting,P3,90,25,0.8,I,zoom meeting recorder,ok,,,,,,,,,,
zoom meeting minutes,P3,110,40,2.9,I,zoom meeting notes,ok,,,,,,,,,,
zoom note taking,P3,90,28,2.52,I,zoom meeting notes,ok,,,,,,,,,,
zoom ai note taking,P3,110,44,2.11,I,zoom meeting notes,ok,,,,,,,,,,
how to copy zoom transcript,P3,70,12,0,I,zoom transcription,ok,,,,,,,,,,
how to turn off transcript on zoom,P3,70,12,0,I,zoom transcription,ok,,,,,,,,,,
how to get transcript from zoom meeting,P3,70,13,0.93,I,zoom transcription,ok,,,,,,,,,,
how to access zoom transcript,P3,70,13,0,I,zoom transcription,ok,,,,,,,,,,
how to download zoom meeting recording,P3,70,13,0,I,zoom meeting recorder,ok,,,,,,,,,,
record zoom meeting on iphone,P3,70,13,1.16,I,zoom meeting recorder,ok,,,,,,,,,,
are zoom meetings automatically recorded,P3,70,13,0,I,zoom meeting recorder,ok,,,,,,,,,,
transcript from zoom recording,P3,70,14,2.22,I,zoom transcription,ok,,,,,,,,,,
zoom video transcription,P3,70,14,1.67,I,zoom transcription,ok,,,,,,,,,,
how to get transcripts of zoom meeting,P3,70,14,1.13,I,zoom transcription,ok,,,,,,,,,,
screen recorder for zoom meeting,P3,70,14,0,"I,N",zoom meeting recorder,ok,,,,,,,,,,
how to screen record zoom meeting with audio,P3,70,14,0.8,"I,N",zoom meeting recorder,ok,,,,,,,,,,
screen recording for zoom meeting,P3,70,16,0,"I,N",zoom meeting recorder,ok,,,,,,,,,,
how to screen record zoom meeting,P3,70,16,0.79,"I,N",zoom meeting recorder,ok,,,,,,,,,,
can you screen record zoom meetings,P3,70,16,0,"I,N",zoom meeting recorder,ok,,,,,,,,,,
enable transcript in zoom,P3,70,18,1.95,I,zoom transcription,ok,,,,,,,,,,
enable transcription in zoom,P3,70,18,1.95,I,zoom transcription,ok,,,,,,,,,,
zoom record transcript,P3,70,18,1.97,I,zoom transcription,ok,,,,,,,,,,
how to get transcripts on zoom,P3,70,18,1.39,I,zoom transcription,ok,,,,,,,,,,
zoom recording transcription,P3,70,19,1.97,I,zoom transcription,ok,,,,,,,,,,
enabling transcription in zoom,P3,70,19,1.95,I,zoom transcription,ok,,,,,,,,,,
zoom video transcript,P3,70,19,1.67,I,zoom transcription,ok,,,,,,,,,,
can zoom record meetings,P3,70,19,0.29,I,zoom meeting recorder,ok,,,,,,,,,,
zoom download transcript,P3,70,20,0,I,zoom transcription,ok,,,,,,,,,,
can you record a zoom meeting for free,P3,70,20,0.89,I,zoom meeting recorder,ok,,,,,,,,,,
how to record zoom meeting on windows,P3,70,20,0.73,"I,N",zoom meeting recorder,ok,,,,,,,,,,
can anyone record a zoom meeting,P3,70,20,0,I,zoom meeting recorder,ok,,,,,,,,,,
recording zoom meeting on iphone,P3,70,20,1.16,I,zoom meeting recorder,ok,,,,,,,,,,
how to take notes during zoom meeting automatically,P3,90,38,2.42,I,zoom meeting notes,ok,,,,,,,,,,
how do you record zoom meeting,P3,70,25,0.34,I,zoom meeting recorder,ok,,,,,,,,,,
notetaker for zoom,P3,70,26,2.73,I,zoom meeting notes,ok,,,,,,,,,,
recording meetings on zoom,P3,70,28,2.79,I,zoom meeting recorder,ok,,,,,,,,,,
record meetings in zoom,P3,70,28,2.36,I,zoom meeting recorder,ok,,,,,,,,,,
can you record a zoom meeting,P3,60,18,0.04,I,zoom meeting recorder,ok,,,,,,,,,,
record meeting on zoom,P3,70,31,2.79,I,zoom meeting recorder,ok,,,,,,,,,,
record meeting in zoom,P3,70,31,2.36,I,zoom meeting recorder,ok,,,,,,,,,,
live transcription zoom,P3,50,10,2.13,I,zoom transcription,ok,,,,,,,,,,
live transcript zoom,P3,50,10,2.13,I,zoom transcription,ok,,,,,,,,,,
where are recorded zoom meetings stored,P3,50,12,0,I,zoom meeting recorder,ok,,,,,,,,,,
zoom transcription without recording,P3,50,13,2.44,I,zoom transcription,ok,,,,,,,,,,
get transcript from zoom recording,P3,50,13,1.52,I,zoom transcription,ok,,,,,,,,,,
how to get a transcript from zoom,P3,50,13,1.5,I,zoom transcription,ok,,,,,,,,,,
how to get zoom meeting transcript,P3,50,13,1.53,I,zoom transcription,ok,,,,,,,,,,
how to download transcript from zoom recording,P3,50,13,1.56,I,zoom transcription,ok,,,,,,,,,,
download zoom meeting recording,P3,50,13,0,I,zoom meeting recorder,ok,,,,,,,,,,
how to download a recorded zoom meeting,P3,50,13,0,I,zoom meeting recorder,ok,,,,,,,,,,
how to get a transcript of a zoom recording,P3,50,14,2.26,I,zoom transcription,ok,,,,,,,,,,
note taker for zoom,P3,70,39,2.88,I,zoom meeting notes,ok,,,,,,,,,,
zoom meeting assistant,P3,70,40,4.32,"I,N",zoom meeting notes,ok,,,,,,,,,,
how to watch recorded zoom meetings,P3,50,16,0,I,zoom meeting recorder,ok,,,,,,,,,,
how to copy transcript from zoom,P3,50,17,0,I,zoom transcription,ok,,,,,,,,,,
can i record my zoom meeting,P3,50,18,0.29,I,zoom meeting recorder,ok,,,,,,,,,,
zoom enable transcription,P3,50,19,3.55,I,zoom transcription,ok,,,,,,,,,,
zoom turn on transcription,P3,50,19,2.89,I,zoom transcription,ok,,,,,,,,,,
how to turn on transcript on zoom,P3,50,19,0,I,zoom transcription,ok,,,,,,,,,,
how to use zoom transcription,P3,50,19,2.41,I,zoom transcription,ok,,,,,,,,,,
how can you record a zoom meeting,P3,50,19,1.57,I,zoom meeting recorder,ok,,,,,,,,,,
where do i find my recorded zoom meeting,P3,50,19,0,I,zoom meeting recorder,ok,,,,,,,,,,
can i record a zoom meeting as a participant,P3,50,20,0.49,I,zoom meeting recorder,ok,,,,,,,,,,
can you record zoom meeting on phone,P3,50,20,0,I,zoom meeting recorder,ok,,,,,,,,,,
how to record zoom meeting on phone with audio,P3,50,20,0,I,zoom meeting recorder,ok,,,,,,,,,,
can i record zoom meetings for free,P3,50,20,0.98,"I,N",zoom meeting recorder,ok,,,,,,,,,,
automatically record zoom meetings,P3,50,20,2.79,I,zoom meeting recorder,ok,,,,,,,,,,
record meeting zoom,P3,50,21,3.97,I,zoom meeting recorder,ok,,,,,,,,,,
can a participant record a zoom meeting,P3,50,22,0,I,zoom meeting recorder,ok,,,,,,,,,,
are all zoom meetings recorded,P3,50,22,0,I,zoom meeting recorder,ok,,,,,,,,,,
ai meeting summary tool,P3,70,45,3.37,I,zoom notetaker,ok,,,,,,,,,,
is there a way to record a zoom meeting,P3,50,23,1.48,I,zoom meeting recorder,ok,,,,,,,,,,
how to access a recorded zoom meeting,P3,50,23,0,I,zoom meeting recorder,ok,,,,,,,,,,
how record zoom meeting,P3,50,24,0.43,I,zoom meeting recorder,ok,,,,,,,,,,
can you record meetings on zoom,P3,50,24,0.16,I,zoom meeting recorder,ok,,,,,,,,,,
how do i record a meeting on zoom,P3,50,24,0.07,I,zoom meeting recorder,ok,,,,,,,,,,
virtual note taking,P3,90,58,2.69,I,zoom notetaker,ok,,,,,,,,,,
script zoom,P3,40,6,0,I,zoom transcription,ok,,,,,,,,,,
free zoom transcription,P3,40,6,2.32,I,zoom transcription,ok,,,,,,,,,,
zoom script,P3,40,7,0,I,zoom transcription,ok,,,,,,,,,,
zoom scripts,P3,40,7,0,I,zoom transcription,ok,,,,,,,,,,
ai notes zoom,P3,50,26,2.61,I,zoom meeting notes,ok,,,,,,,,,,
can zoom take meeting notes,P3,50,26,3.2,I,zoom meeting notes,ok,,,,,,,,,,
how to convert zoom recording,P3,40,10,0,I,zoom transcription,ok,,,,,,,,,,
ai meeting summary tools,P3,70,50,3.37,I,zoom notetaker,ok,,,,,,,,,,
transcription of zoom meeting,P3,40,13,1.81,I,zoom transcription,ok,,,,,,,,,,
transcripts of zoom meetings,P3,40,13,1.81,I,zoom transcription,ok,,,,,,,,,,
transcript of zoom meeting,P3,40,13,1.81,I,zoom transcription,ok,,,,,,,,,,
transcribe a zoom recording,P3,40,13,3.16,I,zoom transcription,ok,,,,,,,,,,
zoom recording to transcript,P3,40,13,1.64,I,zoom transcription,ok,,,,,,,,,,
convert zoom recording to transcript,P3,40,13,2.46,I,zoom transcription,ok,,,,,,,,,,
how to get a transcript from a zoom meeting,P3,40,13,1.62,I,zoom transcription,ok,,,,,,,,,,
summarize meeting,P3,50,31,3.24,I,zoom ai notes,ok,,,,,,,,,,
how to enable zoom transcription,P3,40,18,0,I,zoom transcription,ok,,,,,,,,,,
how to get zoom recording transcript,P3,40,19,1.47,I,zoom transcription,ok,,,,,,,,,,
notetakers,P3,70,54,1.93,I,zoom notetaker,ok,,,,,,,,,,
zoom meeting ai,P3,50,36,2.41,I,zoom meeting notes,ok,,,,,,,,,,
zoom transcription tool,P3,40,20,2.55,I,zoom transcription,ok,,,,,,,,,,
ai note taking zoom,P3,40,23,1.85,I,zoom meeting notes,ok,,,,,,,,,,
ai note taking for zoom,P3,40,25,2.83,I,zoom meeting notes,ok,,,,,,,,,,
how to take notes on zoom,P3,40,27,2.21,I,zoom meeting notes,ok,,,,,,,,,,
ai for zoom meetings,P3,40,30,2.16,I,zoom meeting notes,ok,,,,,,,,,,
zoom notes ai,P3,40,31,1.9,I,zoom meeting notes,ok,,,,,,,,,,
virtual note taker,P3,90,70,2.69,I,zoom notetaker,ok,,,,,,,,,,
zoom note taking app,P3,40,34,3.26,I,zoom meeting notes,ok,,,,,,,,,,
zoom note taker app,P3,40,34,3.26,I,zoom meeting notes,ok,,,,,,,,,,
meeting transcription zoom,P3,30,12,2.09,I,zoom transcription,ok,,,,,,,,,,
transcription zoom meeting,P3,30,13,1.86,I,zoom transcription,ok,,,,,,,,,,
zoom transcript of meeting,P3,30,13,1.97,I,zoom transcription,ok,,,,,,,,,,
zoom transcription free,P3,30,13,2.65,I,zoom transcription,ok,,,,,,,,,,
download transcript from zoom,P3,30,13,0,I,zoom transcription,ok,,,,,,,,,,
transcript for zoom,P3,30,13,2.17,I,zoom transcription,ok,,,,,,,,,,
transcribe a zoom recording free,P3,30,13,3.15,I,transcribe zoom recording,ok,,,,,,,,,,
transcribe zoom recording to text,P3,30,13,2.6,I,transcribe zoom recording,ok,,,,,,,,,,
zoom api transcript,P3,30,14,0,I,zoom transcription,ok,,,,,,,,,,
zoom recording and transcription,P3,30,18,3.18,"I,N",zoom transcription,ok,,,,,,,,,,
turn on transcription zoom,P3,30,18,0,I,zoom transcription,ok,,,,,,,,,,
transcript zoom meeting,P3,30,18,1.86,I,zoom transcription,ok,,,,,,,,,,
zoom transcript feature,P3,30,18,2.31,I,zoom transcription,ok,,,,,,,,,,
get zoom transcript,P3,30,18,2.21,"I,N",zoom transcription,ok,,,,,,,,,,
transcript of zoom recording,P3,30,18,2.24,"I,N",zoom transcription,ok,,,,,,,,,,
enable zoom transcription,P3,30,18,2.61,I,zoom transcription,ok,,,,,,,,,,
