keyword,priority,volume,kd,cpc,intent,seed,flag,published,Ссылка конкурента 1,Ссылка конкурента 2,Ссылка конкурента 3,Заголовок конкурента 1,Заголовок конкурента 2,Заголовок конкурента 3,Сниппет конкурента 1,Сниппет конкурента 2,Сниппет конкурента 3
business meeting follow up email,P3,30,29,0,I,meeting follow up,ok,,,,,,,,,,
action item form,P3,30,31,0,I,action items from meeting,ok,,,,,,,,,,
action item list example,P3,30,31,0,I,action items from meeting,ok,,,,,,,,,,
follow up email after business meeting,P3,30,33,0,I,meeting follow up,ok,,,,,,,,,,
follow up note after meeting,P3,30,36,0,I,meeting follow up,ok,,,,,,,,,,
action items in meeting minutes example,P3,20,12,0,I,meeting action items,ok,,,,,,,,,,
minutes of meeting template with action items excel,P3,20,19,0,I,meeting action items,ok,,,,,,,,,,
follow up email after meeting someone at a networking event,P3,20,20,0,I,meeting follow up,ok,,,,,,,,,,
action item tracker template excel,P3,20,20,0,I,action item tracker,ok,,,,,,,,,,
action item tracker excel template,P3,20,20,0,I,action item tracker,ok,,,,,,,,,,
meeting follow up action items template,P3,20,23,0,I,meeting action items,ok,,,,,,,,,,
follow up email subject line after meeting,P3,20,23,0,I,meeting follow up,ok,,,,,,,,,,
sample follow up email after business meeting,P3,20,23,0,I,meeting follow up,ok,,,,,,,,,,
follow up email after meeting subject line,P3,20,23,0,I,meeting follow up,ok,,,,,,,,,,
follow up email after business meeting template,P3,20,26,0,I,meeting follow up,ok,,,,,,,,,,
follow up email after meeting request,P3,20,26,0,I,meeting follow up,ok,,,,,,,,,,
follow up email after business meeting sample,P3,20,27,0,I,meeting follow up,ok,,,,,,,,,,
sample email follow up after business meeting,P3,20,27,0,I,meeting follow up,ok,,,,,,,,,,
meeting minutes and action items template excel,P3,20,28,0,I,meeting action items,ok,,,,,,,,,,
business meeting follow up email sample,P3,20,28,0,I,meeting follow up,ok,,,,,,,,,,
meeting request follow up email,P3,20,28,0,I,meeting follow up,ok,,,,,,,,,,
follow up to our meeting,P3,20,29,0,I,meeting follow up,ok,,,,,,,,,,
following up on our meeting,P3,20,29,0,I,meeting follow up,ok,,,,,,,,,,
business meeting follow up email template,P3,20,30,0,I,meeting follow up,ok,,,,,,,,,,
example of follow up email after business meeting,P3,20,30,0,I,meeting follow up,ok,,,,,,,,,,
follow up email on meeting request,P3,20,30,0,I,meeting follow up,ok,,,,,,,,,,
follow up email to client after meeting,P3,20,31,0,I,meeting follow up,ok,,,,,,,,,,
follow up email after meeting with client,P3,20,33,0,I,meeting follow up,ok,,,,,,,,,,
client meeting follow up email,P3,20,33,0,I,meeting follow up,ok,,,,,,,,,,
follow up email client after meeting,P3,20,33,0,"I,N",meeting follow up,ok,,,,,,,,,,
follow up email after meeting a client,P3,20,33,0,"I,N",meeting follow up,ok,,,,,,,,,,
follow up email for a meeting request,P3,20,34,0,I,meeting follow up,ok,,,,,,,,,,
follow up meeting request email,P3,20,37,0,I,meeting follow up,ok,,,,,,,,,,
follow up email for meeting request,P3,20,39,0,I,meeting follow up,ok,,,,,,,,,,
follow up email after meeting client,P3,20,43,0,I,meeting follow up,ok,,,,,,,,,,
follow up email after client meeting,P3,20,43,0,I,meeting follow up,ok,,,,,,,,,,
confluence action item tracker,P3,10,7,0,I,action item tracker,ok,,,,,,,,,,
post meeting action items,P3,10,9,0,I,meeting action items,ok,,,,,,,,,,
action item tracker google sheets,P3,10,10,0,"I,N",action item tracker,ok,,,,,,,,,,
sharepoint action item tracker,P3,10,10,2.72,I,action item tracker,ok,,,,,,,,,,
action items from the meeting,P3,10,12,0,I,action items from meeting,ok,,,,,,,,,,
confluence meeting notes action items,P3,10,14,0,I,meeting action items,ok,,,,,,,,,,
post interview follow up meeting,P3,10,18,0,I,post meeting follow up,ok,,,,,,,,,,
formal meeting minutes with action items template,P3,10,19,0,I,meeting action items,ok,,,,,,,,,,
meeting action items tracker,P3,10,19,0,"I,N",meeting action items,ok,,,,,,,,,,
sample meeting notes with action items,P3,10,20,0,"I,N",meeting action items,ok,,,,,,,,,,
examples of meeting minutes with action items,P3,10,25,0,"I,N",meeting action items,ok,,,,,,,,,,
meeting minutes with action item list template,P3,10,26,0,I,meeting action items,ok,,,,,,,,,,
meeting minutes example with action items,P3,10,26,0,I,meeting action items,ok,,,,,,,,,,
project action item tracker,P3,10,26,5.33,"I,N",action item tracker,ok,,,,,,,,,,
meeting task list template,P3,10,27,0,I,meeting task list,ok,,,,,,,,,,
free action item tracker excel template,P3,10,27,0,I,action item tracker,ok,,,,,,,,,,
meeting minutes action items example,P3,10,28,0,"I,N",meeting action items,ok,,,,,,,,,,
example minutes of meeting with action items,P3,10,28,0,"I,N",meeting action items,ok,,,,,,,,,,
minutes of meeting template with action items excel download,P3,10,29,0,I,meeting action items,ok,,,,,,,,,,
sample meeting minutes with action items,P3,10,30,0,I,meeting action items,ok,,,,,,,,,,
meeting next steps template,P3,10,30,0,I,meeting next steps,ok,,,,,,,,,,
open source action item tracker,P3,10,31,0,I,action item tracker,ok,,,,,,,,,,
free action item tracker,P3,10,32,9.49,I,action item tracker,ok,,,,,,,,,,
online action item tracker,P3,10,32,0,"I,N",action item tracker,ok,,,,,,,,,,
best action item tracker,P3,10,33,1.63,I,action item tracker,ok,,,,,,,,,,
minutes of meeting template with action items doc,P3,10,34,0,I,meeting action items,ok,,,,,,,,,,
template for meeting minutes and action items,P3,10,34,0,I,meeting action items,ok,,,,,,,,,,
sample minutes of meeting template with action items,P3,10,34,0,I,meeting action items,ok,,,,,,,,,,
post meeting follow up email,P3,10,35,0,"I,N",post meeting follow up,ok,,,,,,,,,,
action item tracker app,P3,10,36,0,"I,N",action item tracker,ok,,,,,,,,,,
minutes of meeting template with action items word,P3,10,37,0,I,meeting action items,ok,,,,,,,,,,
meeting agenda and action items template,P3,10,39,0,"I,N",meeting action items,ok,,,,,,,,,,
sample meeting agenda with action items,P3,10,40,0,I,meeting action items,ok,,,,,,,,,,
automatic action items from meetings,P3,0,34,0,I,action items from meeting,ok,,,,,,,,,,
meeting action items ai,P3,0,65,0,I,meeting action items,ok,,,,,,,,,,
capture meeting action items,P3,0,34,0,I,meeting action items,ok,,,,,,,,,,
meeting action items sync,P3,0,7,0,I,meeting action items,ok,,,,,,,,,,
meeting action items api,P3,0,13,0,I,meeting action items,ok,,,,,,,,,,
