keyword,priority,volume,kd,cpc,intent,seed,flag,published,Ссылка конкурента 1,Ссылка конкурента 2,Ссылка конкурента 3,Заголовок конкурента 1,Заголовок конкурента 2,Заголовок конкурента 3,Сниппет конкурента 1,Сниппет конкурента 2,Сниппет конкурента 3
meeting follow ups,P1,590,11,0,I,meeting follow up,ok,,,,,,,,,,
conference agenda,P1,590,13,1.93,I,meeting task list,ok,,,,,,,,,,
agenda for a conference,P1,590,14,1.93,I,meeting task list,ok,,,,,,,,,,
agenda for conference,P1,590,15,1.93,I,meeting task list,ok,,,,,,,,,,
template action items,P1,590,17,2.16,I,action items from meeting,ok,,,,,,,,,,
actionable items template,P1,590,17,2.16,I,action items from meeting,ok,,,,,,,,,,
template for action items,P1,590,17,2.16,I,action items from meeting,ok,,,,,,,,,,
follow up from meeting,P1,590,17,0,I,meeting follow up,ok,,,,,,,,,,
follow up on meeting,P1,590,17,0,I,meeting follow up,ok,,,,,,,,,,
follow up meetings,P1,590,17,0,I,meeting follow up,ok,,,,,,,,,,
follow up the meeting,P1,590,17,0,I,meeting follow up,ok,,,,,,,,,,
follow up on the meeting,P1,590,17,0,I,meeting follow up,ok,,,,,,,,,,
meeting follow-up,P1,590,17,0,I,meeting follow up,ok,,,,,,,,,,
meeting follow up,P1,590,17,0,I,post meeting follow up,ok,,,,,,,,,,
follow up meeting,P1,590,18,0,I,meeting follow up,ok,,,,,,,,,,
action items templates,P1,590,20,2.16,I,action items from meeting,ok,,,,,,,,,,
following up with the meeting,P1,590,20,0,I,meeting follow up,ok,,,,,,,,,,
action item,P2,810,21,3.33,I,action items from meeting,ok,,,,,,,,,,
action item format,P2,590,21,2.16,I,action items from meeting,ok,,,,,,,,,,
action item templates,P2,590,21,2.16,I,action items from meeting,ok,,,,,,,,,,
action items template,P2,590,21,2.16,I,meeting action items,ok,,,,,,,,,,
follow-up email,P2,720,36,5.37,I,meeting follow up,ok,,,,,,,,,,
follow up of meeting,P2,590,24,0,I,meeting follow up,ok,,,,,,,,,,
follow up to meeting,P2,590,24,0,I,meeting follow up,ok,,,,,,,,,,
action item template,P2,590,26,2.16,I,action items from meeting,ok,,,,,,,,,,
agenda sample pdf,P2,590,26,1.44,I,meeting task list,ok,,,,,,,,,,
following up letter,P2,480,10,0.69,I,meeting follow up,ok,,,,,,,,,,
letter for follow up,P2,480,10,0.69,I,meeting follow up,ok,,,,,,,,,,
meeting agenda sample pdf,P2,590,27,1.44,I,meeting task list,ok,,,,,,,,,,
agenda of a conference,P2,590,27,1.93,I,meeting task list,ok,,,,,,,,,,
follow up letters,P2,480,11,0.69,I,meeting follow up,ok,,,,,,,,,,
sample agenda template,P2,590,28,1.19,I,meeting task list,ok,,,,,,,,,,
create agenda,P2,590,28,2.16,I,meeting task list,ok,,,,,,,,,,
example agenda template,P2,590,28,1.19,I,meeting task list,ok,,,,,,,,,,
agenda example,P2,660,36,2.41,I,meeting task list,ok,,,,,,,,,,
example of an agenda template,P2,590,29,1.19,I,meeting task list,ok,,,,,,,,,,
followup letters,P2,480,14,0.69,I,meeting follow up,ok,,,,,,,,,,
letter follow up,P2,480,15,0.69,I,meeting follow up,ok,,,,,,,,,,
letters follow up,P2,480,15,0.69,I,meeting follow up,ok,,,,,,,,,,
agenda format sample,P2,590,31,1.19,I,meeting task list,ok,,,,,,,,,,
sample of agenda format,P2,590,31,1.19,I,meeting task list,ok,,,,,,,,,,
agenda template examples,P2,590,31,1.19,I,meeting task list,ok,,,,,,,,,,
sample agenda format,P2,590,32,1.19,I,meeting task list,ok,,,,,,,,,,
action lists,P2,480,17,5.12,I,action items from meeting,ok,,,,,,,,,,
action tracker,P2,440,10,2.67,I,meeting action items,ok,,,,,,,,,,
make a agenda,P2,590,34,2.16,I,meeting task list,ok,,,,,,,,,,
create a agenda,P2,590,34,2.16,I,meeting task list,ok,,,,,,,,,,
follow up letter,P2,480,20,0.69,I,meeting follow up,ok,,,,,,,,,,
example of a business meeting agenda,P2,590,35,1.45,I,meeting task list,ok,,,,,,,,,,
letter of follow up,P2,480,21,0.69,I,meeting follow up,ok,,,,,,,,,,
agenda format example,P2,590,36,1.19,I,meeting task list,ok,,,,,,,,,,
action list,P2,480,25,5.12,I,action items from meeting,ok,,,,,,,,,,
follow up email after meeting,P2,320,0,1.8,I,meeting follow up,ok,,,,,,,,,,
action item tracker,P2,390,19,3.39,I,action items from meeting,ok,,,,,,,,,,
track action items,P2,390,19,3.39,I,action items from meeting,ok,,,,,,,,,,
action items tracking,P2,390,21,3.39,I,action items from meeting,ok,,,,,,,,,,
action item tracking,P2,390,22,3.39,I,action items from meeting,ok,,,,,,,,,,
tracking action items,P2,390,22,3.39,I,action items from meeting,ok,,,,,,,,,,
examples of follow up letters,P2,320,9,0.02,I,meeting follow up,ok,,,,,,,,,,
examples of follow up letter,P2,320,9,0.02,I,meeting follow up,ok,,,,,,,,,,
action items tracker,P2,390,26,3.39,I,action items from meeting,ok,,,,,,,,,,
follow up letter sample,P2,320,10,0.02,I,meeting follow up,ok,,,,,,,,,,
follow up email template,P2,440,35,2,I,meeting follow up,ok,,,,,,,,,,
conference follow up email,P2,320,11,1.8,I,meeting follow up,ok,,,,,,,,,,
follow up email after a conference,P2,320,11,1.8,I,meeting follow up,ok,,,,,,,,,,
follow up email after conference,P2,320,12,1.8,I,meeting follow up,ok,,,,,,,,,,
action item lists,P2,390,28,2.66,I,action items from meeting,ok,,,,,,,,,,
follow up letters examples,P2,320,13,0.02,I,meeting follow up,ok,,,,,,,,,,
email follow up templates,P2,440,37,2,I,meeting follow up,ok,,,,,,,,,,
following up email template,P2,440,37,2,I,meeting follow up,ok,,,,,,,,,,
follow up letter format,P2,320,14,0.02,I,meeting follow up,ok,,,,,,,,,,
follow up letters sample,P2,320,14,0.02,I,meeting follow up,ok,,,,,,,,,,
sample of follow up letter,P2,320,15,0.02,I,meeting follow up,ok,,,,,,,,,,
list of action items,P2,390,31,2.66,I,action items from meeting,ok,,,,,,,,,,
samples follow up letter,P2,320,16,0.02,I,meeting follow up,ok,,,,,,,,,,
samples follow up letters,P2,320,16,0.02,I,meeting follow up,ok,,,,,,,,,,
follow up emails after meeting,P2,320,17,1.8,I,meeting follow up,ok,,,,,,,,,,
follow up sample letter,P2,320,17,0.02,I,meeting follow up,ok,,,,,,,,,,
project task list excel template,P2,390,32,2.63,I,action item tracker,ok,,,,,,,,,,
example of follow up letter,P2,320,18,0.02,I,meeting follow up,ok,,,,,,,,,,
how to politely follow up an email,P2,320,18,0,I,meeting follow up,ok,,,,,,,,,,
excel template action plan,P2,390,35,2.25,I,action item tracker,ok,,,,,,,,,,
action plan excel template,P2,390,35,2.25,I,action item tracker,ok,,,,,,,,,,
template action plan excel,P2,390,35,2.25,I,action item tracker,ok,,,,,,,,,,
actionable items,P2,320,21,0,I,action items from meeting,ok,,,,,,,,,,
templates meeting minutes,P2,320,21,1.01,I,meeting action items,ok,,,,,,,,,,
how to follow up request on email politely,P2,320,21,0,I,meeting follow up,ok,,,,,,,,,,
how to follow up politely in email,P2,320,21,0,I,meeting follow up,ok,,,,,,,,,,
format for follow up letter,P2,320,21,0.02,I,meeting follow up,ok,,,,,,,,,,
action item list,P2,390,36,2.66,I,action items from meeting,ok,,,,,,,,,,
examples of a follow up letter,P2,320,23,0.02,I,meeting follow up,ok,,,,,,,,,,
how to politely follow up on an email,P2,320,24,0,I,meeting follow up,ok,,,,,,,,,,
sample follow letter,P2,320,24,0.02,I,meeting follow up,ok,,,,,,,,,,
action items list,P2,390,38,2.66,I,action items from meeting,ok,,,,,,,,,,
excel template for project task list,P2,390,38,2.63,I,action item tracker,ok,,,,,,,,,,
follow up to email,P2,360,33,5.37,I,meeting follow up,ok,,,,,,,,,,
sample letter follow up,P2,320,25,0.02,I,meeting follow up,ok,,,,,,,,,,
how to follow up email politely,P2,320,26,0,I,meeting follow up,ok,,,,,,,,,,
follow up email after a meeting,P2,320,26,1.8,I,meeting follow up,ok,,,,,,,,,,
items tracker,P2,270,13,0.21,I,action item tracker,ok,,,,,,,,,,
staff meeting minutes templates,P2,320,27,1.32,I,meeting action items,ok,,,,,,,,,,
follow up after meeting email,P2,320,27,1.8,I,meeting follow up,ok,,,,,,,,,,
examples follow up letters,P2,320,27,0.02,I,meeting follow up,ok,,,,,,,,,,
follow up to meeting email,P2,320,27,1.8,I,meeting follow up,ok,,,,,,,,,,
meeting minutes action items template,P2,260,11,1.54,I,action items from meeting,ok,,,,,,,,,,
follow up email to,P2,360,36,5.37,I,meeting follow up,ok,,,,,,,,,,
minutes of meeting template with action items,P2,260,12,1.54,I,action items from meeting,ok,,,,,,,,,,
chasing email,P2,320,29,6.72,I,meeting follow up,ok,,,,,,,,,,
templates for meeting minutes with action items,P2,260,13,1.54,I,action items from meeting,ok,,,,,,,,,,
conference follow up email template,P2,260,13,0,I,meeting follow up,ok,,,,,,,,,,
template follow up letter,P2,320,30,0.02,I,meeting follow up,ok,,,,,,,,,,
meeting minute template with action items,P2,260,14,1.54,I,action items from meeting,ok,,,,,,,,,,
conference follow up email sample,P2,260,14,0,I,meeting follow up,ok,,,,,,,,,,
action items meeting minutes template,P2,260,15,1.54,I,action items from meeting,ok,,,,,,,,,,
follow up email for meeting,P2,320,31,1.8,I,meeting follow up,ok,,,,,,,,,,
follow up emails after a meeting,P2,320,31,1.8,I,meeting follow up,ok,,,,,,,,,,
follow up email on meeting,P2,320,31,1.8,I,meeting follow up,ok,,,,,,,,,,
following up email after meeting,P2,320,31,1.8,I,meeting follow up,ok,,,,,,,,,,
follow up meeting email,P2,320,31,1.8,I,meeting follow up,ok,,,,,,,,,,
meeting minutes template action items,P2,260,16,1.54,I,action items from meeting,ok,,,,,,,,,,
template of meeting minutes with action items,P2,260,16,1.54,I,action items from meeting,ok,,,,,,,,,,
follow up email for previous email,P2,320,32,0,I,meeting follow up,ok,,,,,,,,,,
follow up from previous email,P2,320,32,0,I,post meeting follow up,ok,,,,,,,,,,
follow-up email after meeting example,P2,260,17,0,I,post meeting follow up,ok,,,,,,,,,,
meeting follow up email,P2,320,33,1.8,I,meeting follow up,ok,,,,,,,,,,
email follow up after meeting,P2,320,33,1.8,I,meeting follow up,ok,,,,,,,,,,
follow up email for a meeting,P2,320,33,1.8,I,meeting follow up,ok,,,,,,,,,,
follow up email from meeting,P2,320,33,1.8,I,meeting follow up,ok,,,,,,,,,,
follow up email after the meeting,P2,320,33,1.8,I,meeting follow up,ok,,,,,,,,,,
after meeting follow up email,P2,320,33,1.8,I,meeting follow up,ok,,,,,,,,,,
meeting minutes and action items template,P2,260,18,1.54,I,action items from meeting,ok,,,,,,,,,,
follow up previous email,P2,320,34,0,I,meeting follow up,ok,,,,,,,,,,
follow up email to a meeting,P2,320,34,1.8,I,meeting follow up,ok,,,,,,,,,,
follow up email to meeting,P2,320,34,1.8,I,meeting follow up,ok,,,,,,,,,,
following up on the previous email,P2,320,34,0,I,post meeting follow up,ok,,,,,,,,,,
meeting minutes template with action items,P2,260,19,1.54,I,action items from meeting,ok,,,,,,,,,,
meeting minutes with action items template,P2,260,19,1.54,I,action items from meeting,ok,,,,,,,,,,
template for meeting minutes with action items,P2,260,19,1.54,I,action items from meeting,ok,,,,,,,,,,
follow up sample letters,P2,320,35,0.02,I,meeting follow up,ok,,,,,,,,,,
chasing emails,P2,320,35,6.72,I,meeting follow up,ok,,,,,,,,,,
minute taking formats,P2,260,20,0.68,I,meeting action items,ok,,,,,,,,,,
meeting notes forms,P2,260,23,1.36,I,meeting action items,ok,,,,,,,,,,
follow up on my previous email,P2,260,23,0,I,post meeting follow up,ok,,,,,,,,,,
follow up or follow up email,P2,260,24,0,I,post meeting follow up,ok,,,,,,,,,,
meeting tracker,P2,210,6,4.35,I,meeting action items,ok,,,,,,,,,,
meeting minutes with action items sample,P2,260,25,1.54,I,action items from meeting,ok,,,,,,,,,,
email template follow up after meeting,P2,260,26,0,I,meeting follow up,ok,,,,,,,,,,
follow up email after meeting template,P2,260,26,0,I,meeting follow up,ok,,,,,,,,,,
follow up email after meeting example,P2,260,27,0,I,meeting follow up,ok,,,,,,,,,,
after meeting follow up email sample,P2,260,27,0,I,meeting follow up,ok,,,,,,,,,,
following up my previous email,P2,260,27,0,I,post meeting follow up,ok,,,,,,,,,,
post meeting,P2,210,10,0,I,post meeting follow up,ok,,,,,,,,,,
sample follow up email after meeting,P2,260,28,0,I,meeting follow up,ok,,,,,,,,,,
tracking meetings,P2,210,11,4.35,I,action items from meeting,ok,,,,,,,,,,
thank you for the follow up,P2,210,12,0,I,post meeting follow up,ok,,,,,,,,,,
polite follow-up email sample for a request,P2,260,30,0,I,post meeting follow up,ok,,,,,,,,,,
follow up email template after meeting,P2,260,31,0,I,meeting follow up,ok,,,,,,,,,,
polite follow up email sample for a request,P2,260,31,0,I,meeting follow up,ok,,,,,,,,,,
follow up or follow-up email,P2,260,31,0,I,post meeting follow up,ok,,,,,,,,,,
action item synonym,P2,210,15,0,I,action items from meeting,ok,,,,,,,,,,
follow up email after meeting sample,P2,260,33,0,I,meeting follow up,ok,,,,,,,,,,
follow up meeting email template,P2,260,33,0,I,meeting follow up,ok,,,,,,,,,,
template for follow up email after a meeting,P2,260,33,0,I,meeting follow up,ok,,,,,,,,,,
meeting follow up email sample,P2,260,33,0,I,meeting follow up,ok,,,,,,,,,,
examples of follow up emails after a meeting,P2,260,33,0,I,meeting follow up,ok,,,,,,,,,,
follow up meeting email example,P2,260,33,0,I,meeting follow up,ok,,,,,,,,,,
meeting follow up email examples,P2,260,33,0,I,meeting follow up,ok,,,,,,,,,,
example follow up email after meeting,P2,260,33,0,I,meeting follow up,ok,,,,,,,,,,
sample of follow up email after meeting,P2,260,33,0,I,meeting follow up,ok,,,,,,,,,,
following up on my previous email,P2,260,34,0,I,meeting follow up,ok,,,,,,,,,,
meeting follow up email template,P2,260,35,0,I,meeting follow up,ok,,,,,,,,,,
template follow up email after meeting,P2,260,35,0,I,meeting follow up,ok,,,,,,,,,,
action items synonym,P2,210,20,0,I,action items from meeting,ok,,,,,,,,,,
follow up meeting email sample,P2,260,36,0,I,meeting follow up,ok,,,,,,,,,,
what is a follow up email,P2,260,36,0,I,meeting follow up,ok,,,,,,,,,,
meeting follow up email example,P2,260,36,0,I,meeting follow up,ok,,,,,,,,,,
follow up email to colleague,P2,260,39,0,I,meeting follow up,ok,,,,,,,,,,
polite follow up email,P2,210,27,0,I,post meeting follow up,ok,,,,,,,,,,
follow up message,P2,210,33,0,I,post meeting follow up,ok,,,,,,,,,,
excel action plan template,P2,210,35,1.6,I,action item tracker,ok,,,,,,,,,,
meeting format,P2,210,40,2.63,I,meeting action items,ok,,,,,,,,,,
agenda,P3,60500,72,0.82,"L,C",meeting task list,ok,,,,,,,,,,
follow up email,P3,4400,70,5.37,I,meeting follow up,ok,,,,,,,,,,
action items,P3,2400,65,3.33,I,action items from meeting,ok,,,,,,,,,,
follow up on an email,P3,1900,68,5.37,I,meeting follow up,ok,,,,,,,,,,
how to write a follow up email,P3,1600,71,0.7,I,meeting follow up,ok,,,,,,,,,,
email follow up,P3,1500,70,6.76,I,meeting follow up,ok,,,,,,,,,,
followup email,P3,1300,69,5.37,I,meeting follow up,ok,,,,,,,,,,
agenda sample format,P3,590,41,1.19,I,meeting task list,ok,,,,,,,,,,
examples of business meeting agendas,P3,590,41,1.45,I,meeting task list,ok,,,,,,,,,,
format for business meeting agenda,P3,590,41,1.45,I,meeting task list,ok,,,,,,,,,,
how to create a agenda,P3,590,44,0.65,I,meeting task list,ok,,,,,,,,,,
making agenda,P3,590,44,2.16,I,meeting task list,ok,,,,,,,,,,
how to create a meeting agenda,P3,590,45,0.65,I,meeting task list,ok,,,,,,,,,,
what actions,P3,1100,71,0,I,action items from meeting,ok,,,,,,,,,,
creating agendas,P3,590,48,2.16,I,meeting task list,ok,,,,,,,,,,
how to create an agenda for a meeting,P3,590,49,0.65,I,meeting task list,ok,,,,,,,,,,
making agendas,P3,590,51,2.16,I,meeting task list,ok,,,,,,,,,,
making an agenda,P3,590,53,2.16,I,meeting task list,ok,,,,,,,,,,
making agendas for meetings,P3,590,53,2.16,I,meeting task list,ok,,,,,,,,,,
creating an agenda for a meeting,P3,590,53,2.16,I,meeting task list,ok,,,,,,,,,,
creating agenda,P3,590,53,2.16,I,meeting task list,ok,,,,,,,,,,
follow-up email template,P3,440,41,2,I,meeting follow up,ok,,,,,,,,,,
email templates for follow up,P3,440,42,2,I,meeting follow up,ok,,,,,,,,,,
email template for follow up,P3,440,42,2,I,meeting follow up,ok,,,,,,,,,,
action items for meeting minutes,P3,170,5,0,I,action items from meeting,ok,,,,,,,,,,
meeting notes action items,P3,170,6,0,I,action items from meeting,ok,,,,,,,,,,
minutes of meeting action items,P3,170,6,0,I,action items from meeting,ok,,,,,,,,,,
action log,P3,170,6,2.6,I,action item tracker,ok,,,,,,,,,,
action items on meeting minutes,P3,170,8,0,I,action items from meeting,ok,,,,,,,,,,
minutes action items,P3,170,9,0,I,action items from meeting,ok,,,,,,,,,,
action items in minutes of meeting,P3,170,9,0,I,action items from meeting,ok,,,,,,,,,,
meeting notes with action items,P3,170,9,0,I,action items from meeting,ok,,,,,,,,,,
meeting notes and action items,P3,170,9,0,I,action items from meeting,ok,,,,,,,,,,
action items meeting minutes,P3,170,9,0,I,action items from meeting,ok,,,,,,,,,,
action items in minutes,P3,170,9,0,I,action items from meeting,ok,,,,,,,,,,
meeting minutes and action items,P3,170,10,0,I,action items from meeting,ok,,,,,,,,,,
meeting minutes with action items,P3,170,10,0,I,action items from meeting,ok,,,,,,,,,,
rolling action item list,P3,170,15,4.36,I,action items from meeting,ok,,,,,,,,,,
action items in meeting minutes,P3,170,15,0,I,action items from meeting,ok,,,,,,,,,,
meeting minutes action items,P3,170,16,0,I,action items from meeting,ok,,,,,,,,,,
action sheet,P3,170,21,0,"L,C",meeting action items,ok,,,,,,,,,,
project meeting minutes template,P3,170,21,1.92,I,meeting action items,ok,,,,,,,,,,
action things,P3,170,24,0,I,action items from meeting,ok,,,,,,,,,,
project minutes template,P3,170,24,1.92,I,meeting action items,ok,,,,,,,,,,
minutes and agenda of a meeting,P3,170,26,2.74,I,meeting action items,ok,,,,,,,,,,
action items example,P3,140,17,0.3,I,action items from meeting,ok,,,,,,,,,,
action items examples,P3,140,17,0.3,I,action items from meeting,ok,,,,,,,,,,
examples of action items,P3,140,17,0.3,I,action items from meeting,ok,,,,,,,,,,
meeting agenda minutes template,P3,140,17,1.2,I,meeting action items,ok,,,,,,,,,,
action register,P3,140,20,6.75,I,action items from meeting,ok,,,,,,,,,,
action item template excel,P3,140,20,2.04,I,meeting action items,ok,,,,,,,,,,
excel action item template,P3,140,20,2.04,I,meeting action items,ok,,,,,,,,,,
action item excel template,P3,140,20,2.04,I,action item tracker,ok,,,,,,,,,,
action items template excel,P3,140,20,2.04,I,action item tracker,ok,,,,,,,,,,
it meeting minutes template,P3,150,26,1.01,I,meeting action items,ok,,,,,,,,,,
action item template in excel,P3,140,21,2.04,I,action item tracker,ok,,,,,,,,,,
action tracking template,P3,140,21,2.77,I,action item tracker,ok,,,,,,,,,,
meeting template minutes,P3,140,22,1.01,I,meeting action items,ok,,,,,,,,,,
action tracker template,P3,140,23,2.77,I,meeting action items,ok,,,,,,,,,,
meeting agenda action items template,P3,140,24,1.7,I,action items from meeting,ok,,,,,,,,,,
meeting agenda template action items,P3,140,25,1.7,I,action items from meeting,ok,,,,,,,,,,
meeting agenda template with action items,P3,140,26,1.7,I,action items from meeting,ok,,,,,,,,,,
meeting minutes document,P3,140,26,1.45,I,meeting action items,ok,,,,,,,,,,
action note,P3,110,6,0,I,action items from meeting,ok,,,,,,,,,,
agenda with action items template,P3,140,29,1.7,I,action items from meeting,ok,,,,,,,,,,
action tracker format,P3,140,31,2.77,I,meeting action items,ok,,,,,,,,,,
action notes,P3,110,14,0,I,action items from meeting,ok,,,,,,,,,,
action items list template,P3,110,14,1.84,I,action items from meeting,ok,,,,,,,,,,
template for action items from meeting,P3,110,14,1.61,I,action items from meeting,ok,,,,,,,,,,
action item list template,P3,110,14,1.84,I,action item tracker,ok,,,,,,,,,,
meeting agenda with action items template,P3,140,34,1.7,I,action items from meeting,ok,,,,,,,,,,
meeting action items template,P3,110,16,1.61,I,action items from meeting,ok,,,,,,,,,,
meeting template with action items,P3,110,16,1.61,I,action items from meeting,ok,,,,,,,,,,
agenda template with action items,P3,140,35,1.7,I,action items from meeting,ok,,,,,,,,,,
what are action items in a meeting,P3,90,0,0,I,meeting action items,ok,,,,,,,,,,
meeting agenda templates with action items,P3,140,37,1.7,I,action items from meeting,ok,,,,,,,,,,
action item list format,P3,110,22,1.84,I,action items from meeting,ok,,,,,,,,,,
action items from meeting,P3,90,10,0,I,meeting action items,ok,,,,,,,,,,
sample action item list,P3,110,28,1.84,I,action items from meeting,ok,,,,,,,,,,
meeting action items,P3,90,13,0,I,action items from meeting,ok,,,,,,,,,,
action items in a meeting,P3,90,18,0,I,action items from meeting,ok,,,,,,,,,,
action log template,P3,90,23,2.14,I,action item tracker,ok,,,,,,,,,,
action tracking template excel,P3,90,26,1.99,I,action item tracker,ok,,,,,,,,,,
discussion item,P3,70,5,0,I,action items from meeting,ok,,,,,,,,,,
action tracker template excel,P3,90,27,1.99,I,action item tracker,ok,,,,,,,,,,
action tracker excel template,P3,90,27,1.99,I,action item tracker,ok,,,,,,,,,,
project actions,P3,70,12,0,I,action item tracker,ok,,,,,,,,,,
rolling action item list excel template,P3,70,13,2.14,I,action item tracker,ok,,,,,,,,,,
rolling action item list template excel,P3,70,13,2.14,I,action item tracker,ok,,,,,,,,,,
excel action tracker template,P3,90,33,1.99,I,action item tracker,ok,,,,,,,,,,
rail action item list,P3,70,15,0,I,action items from meeting,ok,,,,,,,,,,
excel action tracker templates,P3,90,34,1.99,I,action item tracker,ok,,,,,,,,,,
another word for action items,P3,70,19,0,I,action items from meeting,ok,,,,,,,,,,
activity list template,P3,70,19,1.1,I,action item tracker,ok,,,,,,,,,,
action item tracker excel,P3,70,20,3.5,I,action item tracker,ok,,,,,,,,,,
excel action item tracker,P3,70,20,3.5,I,action item tracker,ok,,,,,,,,,,
excel template for tracking action items,P3,70,21,2.12,I,action item tracker,ok,,,,,,,,,,
action register template,P3,70,23,2.34,I,action items from meeting,ok,,,,,,,,,,
action item tracker template,P3,70,26,2.49,I,action items from meeting,ok,,,,,,,,,,
action item tracking template,P3,70,26,2.49,I,action items from meeting,ok,,,,,,,,,,
action item tracking excel,P3,70,26,3.5,I,action item tracker,ok,,,,,,,,,,
action items tracker in excel,P3,70,27,3.5,I,action item tracker,ok,,,,,,,,,,
template for tracking action items,P3,70,28,2.49,I,action items from meeting,ok,,,,,,,,,,
how to write a follow up email after a meeting,P3,70,28,0,I,meeting follow up,ok,,,,,,,,,,
how to write follow up email after meeting,P3,70,31,0,I,meeting follow up,ok,,,,,,,,,,
action tasks,P3,50,7,5.51,I,action items from meeting,ok,,,,,,,,,,
check in template excel,P3,70,37,0,I,action item tracker,ok,,,,,,,,,,
post meeting follow up,P3,50,12,0,I,meeting follow up,ok,,,,,,,,,,
thank you email meeting follow up,P3,50,14,0,I,meeting follow up,ok,,,,,,,,,,
action item list template excel,P3,50,14,1.46,I,action item tracker,ok,,,,,,,,,,
follow up after a meeting,P3,50,17,0,I,meeting follow up,ok,,,,,,,,,,
action item log,P3,50,18,0.68,I,action items from meeting,ok,,,,,,,,,,
open items list,P3,50,18,0,I,action item tracker,ok,,,,,,,,,,
action items log,P3,50,19,0.68,I,action items from meeting,ok,,,,,,,,,,
follow up after meeting,P3,50,19,0,I,meeting follow up,ok,,,,,,,,,,
follow up meeting thank you email,P3,50,19,0,I,meeting follow up,ok,,,,,,,,,,
thank you follow up email after meeting,P3,50,19,0,I,meeting follow up,ok,,,,,,,,,,
follow up after the meeting,P3,50,20,0,I,meeting follow up,ok,,,,,,,,,,
follow up thank you email after meeting,P3,50,21,0,I,meeting follow up,ok,,,,,,,,,,
action item list excel template,P3,50,21,1.46,I,action item tracker,ok,,,,,,,,,,
action tracker excel,P3,50,21,2.93,I,action item tracker,ok,,,,,,,,,,
template action,P3,50,21,0,I,action item tracker,ok,,,,,,,,,,
follow up email after meeting someone,P3,50,24,0,I,meeting follow up,ok,,,,,,,,,,
action templates,P3,50,25,0,I,action item tracker,ok,,,,,,,,,,
action agendas,P3,40,7,0,I,action items from meeting,ok,,,,,,,,,,
action minute,P3,40,7,0,I,action items from meeting,ok,,,,,,,,,,
action template,P3,50,27,0,I,action item tracker,ok,,,,,,,,,,
excel action tracker,P3,50,27,2.93,I,action item tracker,ok,,,,,,,,,,
action minutes,P3,40,13,0,I,action items from meeting,ok,,,,,,,,,,
actions list template,P3,40,14,3.57,I,action items from meeting,ok,,,,,,,,,,
schedule follow up meeting in outlook,P3,40,14,0,I,meeting follow up,ok,,,,,,,,,,
action items outlook,P3,40,15,0,I,action items from meeting,ok,,,,,,,,,,
outlook schedule follow up meeting,P3,40,15,0,I,meeting follow up,ok,,,,,,,,,,
action tracker in excel,P3,50,33,2.93,I,action item tracker,ok,,,,,,,,,,
action task,P3,50,40,5.51,I,action items from meeting,ok,,,,,,,,,,
action item table,P3,40,25,2.96,I,action items from meeting,ok,,,,,,,,,,
action list format,P3,40,25,3.57,I,action items from meeting,ok,,,,,,,,,,
follow up meeting template,P3,40,29,0,I,meeting follow up,ok,,,,,,,,,,
meeting actions,P3,30,9,0,I,action items from meeting,ok,,,,,,,,,,
follow up meeting sample,P3,40,33,0,I,meeting follow up,ok,,,,,,,,,,
what are action items in meeting minutes,P3,30,12,0,I,meeting action items,ok,,,,,,,,,,
meeting follow up template,P3,40,35,0,I,meeting follow up,ok,,,,,,,,,,
follow up email business meeting,P3,30,16,0,I,meeting follow up,ok,,,,,,,,,,
follow up meeting after interview,P3,30,19,0,I,meeting follow up,ok,,,,,,,,,,
meeting agenda with action items,P3,30,20,0,I,meeting action items,ok,,,,,,,,,,
business email follow up after meeting,P3,30,24,0,I,meeting follow up,ok,,,,,,,,,,
business follow up email after meeting,P3,30,27,0,I,meeting follow up,ok,,,,,,,,,,
follow up email for business meeting,P3,30,27,0,I,meeting follow up,ok,,,,,,,,,,
meeting agendas with action items,P3,30,28,0,"I,N",meeting action items,ok,,,,,,,,,,
