keyword,priority,volume,kd,cpc,intent,seed,flag,published,Ссылка конкурента 1,Ссылка конкурента 2,Ссылка конкурента 3,Заголовок конкурента 1,Заголовок конкурента 2,Заголовок конкурента 3,Сниппет конкурента 1,Сниппет конкурента 2,Сниппет конкурента 3
how to start steam in offline mode,4,260,20,0,I,offline mode,ok,,,,,,,,,,
how to get spotify off offline mode,4,170,14,0,I,offline mode,ok,,,,,,,,,,
how to get off offline mode on spotify,4,170,14,0,I,offline mode,ok,,,,,,,,,,
apps where you can listen to music offline,4,140,14,0.75,I,offline app,ok,,,,,,,,,,
what is offline mode,4,110,16,0,I,offline mode,ok,,,,,,,,,,
how to appear offline on steam app,4,90,14,0,I,offline app,ok,,,,,,,,,,
why is steam in offline mode,4,70,14,0,I,offline mode,ok,,,,,,,,,,
how to offline apps on iphone,4,50,24,0,"I,N",offline app,ok,,,,,,,,,,
what's the best offline music app,4,50,19,0.55,I,offline app,ok,,,,,,,,,,
how do i run steam in offline mode,4,50,14,0,I,offline mode,ok,,,,,,,,,,
how to run steam in offline mode,4,50,14,0,I,offline mode,ok,,,,,,,,,,
how to download the bible app offline,4,40,21,0.21,I,offline app,ok,,,,,,,,,,
on spotify what is offline mode,4,40,17,0,I,offline mode,ok,,,,,,,,,,
app where you can listen to music without internet,4,30,14,0.41,I,apps without internet,ok,,,,,,,,,,
how to appear offline in facebook app,4,20,20,0,I,offline app,ok,,,,,,,,,,
how to get off offline mode in steam,4,20,14,0,I,offline mode,ok,,,,,,,,,,
what is spotify offline mode,4,20,17,0,I,offline mode,ok,,,,,,,,,,
how to turn off offline mode on spotify,4,20,14,0,I,offline mode,ok,,,,,,,,,,
what is offline mode spotify,4,20,20,0,I,offline mode,ok,,,,,,,,,,
how to stay offline on facebook app,4,10,17,0,I,offline app,ok,,,,,,,,,,
what is the best offline gps app for android,4,10,30,0,I,offline app,ok,,,,,,,,,,
what is the best offline map app for android,4,10,20,0,I,offline app,ok,,,,,,,,,,
how to make offline app,4,10,13,0,I,offline app,ok,,,,,,,,,,
apps which play music offline,4,10,14,0.87,I,offline app,ok,,,,,,,,,,
how to use the bible app offline,4,10,0,0,,offline app,ok,,,,,,,,,,
how to make an app work offline,4,10,21,0,I,offline app,ok,,,,,,,,,,
what is an offline app,4,10,17,0,I,offline app,ok,,,,,,,,,,
how to make an app offline,4,10,14,0,I,offline app,ok,,,,,,,,,,
how to appear offline on facebook messenger app,4,10,17,0,I,offline app,ok,,,,,,,,,,
how to make android app offline,4,10,14,0,I,offline app,ok,,,,,,,,,,
why is my alexa app offline,4,10,16,0,I,offline app,ok,,,,,,,,,,
how to save offline maps in google maps app,4,10,0,0,,offline app,ok,,,,,,,,,,
how to go offline on facebook messenger app,4,10,17,0,I,offline app,ok,,,,,,,,,,
how to install software in ubuntu offline,4,10,20,0,I,offline software,ok,,,,,,,,,,
how to record hulu shows for offline viewing,4,10,10,0,I,offline recording,ok,,,,,,,,,,
how to use ds3 tool offline,4,10,7,0,I,offline tools,ok,,,,,,,,,,
spotify offline mode how does it work,4,10,14,0,I,offline mode,ok,,,,,,,,,,
what is spotify premium offline mode,4,10,14,0,I,offline mode,ok,,,,,,,,,,
what is gmail offline mode,4,10,14,0,I,offline mode,ok,,,,,,,,,,
how to turn off offline mode on android,4,10,10,0,I,offline mode,ok,,,,,,,,,,
minecraft how to change your skin in offline mode,4,10,11,0,I,offline mode,ok,,,,,,,,,,
how to start outlook 2010 in offline mode,4,10,13,0,I,offline mode,ok,,,,,,,,,,
how to download songs for offline mode spotify,4,10,0,0,,offline mode,ok,,,,,,,,,,
how to remove printer from offline mode,4,10,20,0,I,offline mode,ok,,,,,,,,,,
how to get horizon out of offline mode,4,10,7,0,I,offline mode,ok,,,,,,,,,,
how to use offline mode in steam,4,10,14,0,I,offline mode,ok,,,,,,,,,,
how to go offline on the new facebook iphone app,4,0,0,0,,offline app,ok,,,,,,,,,,
how to create offline html5 web apps,4,0,0,0,,offline app,ok,,,,,,,,,,
how to appear offline to someone on facebook app,4,0,0,0,,offline app,ok,,,,,,,,,,
how to appear offline in facebook ipad app,4,0,0,0,,offline app,ok,,,,,,,,,,
how to go offline on the new facebook app,4,0,0,0,,offline app,ok,,,,,,,,,,
is there any app which can store internet from wifi and we can use it after when we are offline,4,0,0,0,,offline app,ok,,,,,,,,,,
how to install apps on ubuntu offline,4,0,0,0,,offline app,ok,,,,,,,,,,
does the app when i work work offline,4,0,0,0,,offline app,ok,,,,,,,,,,
what is the best offline wikipedia app,4,0,0,0,,offline app,ok,,,,,,,,,,
how to go offline on the facebook app for iphone,4,0,0,0,,offline app,ok,,,,,,,,,,
how to install windows 8 apps offline,4,0,0,0,,offline app,ok,,,,,,,,,,
how to read bible app offline,4,0,0,0,,offline app,ok,,,,,,,,,,
what app offline,4,0,0,0,,offline app,ok,,,,,,,,,,
how to go offline on the facebook messenger app,4,0,0,0,,offline app,ok,,,,,,,,,,
how to install softwares in linux offline,4,0,0,0,,offline software,ok,,,,,,,,,,
how to install zune software offline,4,0,0,0,,offline software,ok,,,,,,,,,,
how to get blackberry app world without internet,4,0,0,0,,apps without internet,ok,,,,,,,,,,
how to run ds3 tool offline,4,0,0,0,,offline tools,ok,,,,,,,,,,
how do i play a steam game in offline mode,4,0,0,0,,offline mode,ok,,,,,,,,,,
how do i play steam offline mode,4,0,0,0,,offline mode,ok,,,,,,,,,,
how do i play starcraft 2 in offline mode,4,0,0,0,,offline mode,ok,,,,,,,,,,
how to change work offline mode in outlook 2010,4,0,0,0,,offline mode,ok,,,,,,,,,,
how to start steam in offline mode while offline,4,0,0,0,,offline mode,ok,,,,,,,,,,
how to turn off work offline mode in firefox,4,0,0,0,,offline mode,ok,,,,,,,,,,
how to play half life in offline mode,4,0,0,0,,offline mode,ok,,,,,,,,,,
how to get spotify into offline mode,4,0,0,0,,offline mode,ok,,,,,,,,,,
how to play creative mode in minecraft offline,4,0,0,0,,offline mode,ok,,,,,,,,,,
how to play minecraft lan in offline mode,4,0,0,0,,offline mode,ok,,,,,,,,,,
how to play hawx 2 in offline mode,4,0,0,0,,offline mode,ok,,,,,,,,,,
how to play a minecraft server in offline mode,4,0,0,0,,offline mode,ok,,,,,,,,,,
how do i play steam games in offline mode,4,0,0,0,,offline mode,ok,,,,,,,,,,
how to play starcraft 2 campaign in offline mode,4,0,0,0,,offline mode,ok,,,,,,,,,,
how to play minecraft multiplayer in offline mode,4,0,0,0,,offline mode,ok,,,,,,,,,,
how to make a minecraft server in offline mode,4,0,0,0,,offline mode,ok,,,,,,,,,,
how to start steam in offline mode mac,4,0,0,0,,offline mode,ok,,,,,,,,,,
how to remove offline mode in outlook 2010,4,0,0,0,,offline mode,ok,,,,,,,,,,
how to play minecraft online in offline mode,4,0,0,0,,offline mode,ok,,,,,,,,,,
how to remove work offline mode in outlook 2010,4,0,0,0,,offline mode,ok,,,,,,,,,,
how to disable work offline mode in firefox,4,0,0,0,,offline mode,ok,,,,,,,,,,
how to get nokia e63 off offline mode,4,0,0,0,,offline mode,ok,,,,,,,,,,
how to change steam from offline to online mode,4,0,0,0,,offline mode,ok,,,,,,,,,,
how to play skyrim in steam offline mode,4,0,0,0,,offline mode,ok,,,,,,,,,,
how to play free mode in gta 4 offline,4,0,0,0,,offline mode,ok,,,,,,,,,,
how to get steam to run in offline mode,4,0,0,0,,offline mode,ok,,,,,,,,,,
how to remove offline mode in nokia e52,4,0,0,0,,offline mode,ok,,,,,,,,,,
how to connect to steam in offline mode,4,0,0,0,,offline mode,ok,,,,,,,,,,
how to setup windows live for offline mode play,4,0,0,0,,offline mode,ok,,,,,,,,,,
how to start steam in offline mode automatically,4,0,0,0,,offline mode,ok,,,,,,,,,,
how to get nokia n8 off offline mode,4,0,0,0,,offline mode,ok,,,,,,,,,,
how to remove offline mode in outlook 2003,4,0,0,0,,offline mode,ok,,,,,,,,,,
how to play nfs world in offline mode,4,0,0,0,,offline mode,ok,,,,,,,,,,
how to install max payne 3 reloaded offline mode,4,0,0,0,,offline mode,ok,,,,,,,,,,
how to make steam run in offline mode,4,0,0,0,,offline mode,ok,,,,,,,,,,
how to get steam out of offline mode mac,4,0,0,0,,offline mode,ok,,,,,,,,,,
how can i play starcraft 2 offline mode,4,0,0,0,,offline mode,ok,,,,,,,,,,
how do i force steam into offline mode,4,0,0,0,,offline mode,ok,,,,,,,,,,
how to play driver san francisco offline mode,4,0,0,0,,offline mode,ok,,,,,,,,,,
how to configure outlook 2007 in offline mode,4,0,0,0,,offline mode,ok,,,,,,,,,,
how to get steam to work in offline mode,4,0,0,0,,offline mode,ok,,,,,,,,,,
how to play football manager 2012 offline mode,4,0,0,0,,offline mode,ok,,,,,,,,,,
how to play offline franchise mode on madden 13,4,0,0,0,,offline mode,ok,,,,,,,,,,
how to change spotify from offline to online mode,4,0,0,0,,offline mode,ok,,,,,,,,,,
how to go online on steam from offline mode,4,0,0,0,,offline mode,ok,,,,,,,,,,
how to disable offline mode in outlook 2003,4,0,0,0,,offline mode,ok,,,,,,,,,,
what happened to amazon music offline mode,4,0,0,0,,offline mode,ok,,,,,,,,,,
how to save gta 4 in offline mode,4,0,0,0,,offline mode,ok,,,,,,,,,,
how to play versus mode in l4d2 offline,4,0,0,0,,offline mode,ok,,,,,,,,,,
how do i play my steam games in offline mode,4,0,0,0,,offline mode,ok,,,,,,,,,,
how to change offline mode to online in steam,4,0,0,0,,offline mode,ok,,,,,,,,,,
why my steam is offline mode,4,0,0,0,,offline mode,ok,,,,,,,,,,
can you pause elden ring in offline mode,4,0,0,0,,offline mode,ok,,,,,,,,,,
how to turn off work offline mode in outlook 2007,4,0,0,0,,offline mode,ok,,,,,,,,,,
how to enable cheats in dota 2 offline mode,4,0,0,0,,offline mode,ok,,,,,,,,,,
how to change skin in minecraft offline mode,4,0,0,0,,offline mode,ok,,,,,,,,,,
how to get spotify off offline mode on android,4,0,0,0,,offline mode,ok,,,,,,,,,,
how do i turn off outlook offline mode,4,0,0,0,,offline mode,ok,,,,,,,,,,
how to install a steam game in offline mode,4,0,0,0,,offline mode,ok,,,,,,,,,,
how to fix steam offline mode to online mode mac,4,0,0,0,,offline mode,ok,,,,,,,,,,
how to install games on steam in offline mode,4,0,0,0,,offline mode,ok,,,,,,,,,,
how to play counter strike offline mode,4,0,0,0,,offline mode,ok,,,,,,,,,,
test drive unlimited 2 how to play offline mode,4,0,0,0,,offline mode,ok,,,,,,,,,,
how to start steam in offline mode with internet,4,0,0,0,,offline mode,ok,,,,,,,,,,
how to play gta iv offline mode pc,4,0,0,0,,offline mode,ok,,,,,,,,,,
